InvoiceNo,StockCode,Description,Quantity,InvoiceDate,UnitPrice,CustomerID,Country
537382,22113,GREY HEART HOT WATER BOTTLE,4,12/6/2010 13:13,3.75,16710,United Kingdom
537382,10124A,SPOTS ON RED BOOKCOVER TAPE,4,12/6/2010 13:13,0.42,16710,United Kingdom
537382,84347,ROTATING SILVER ANGELS T-LIGHT HLDR,6,12/6/2010 13:13,2.55,16710,United Kingdom
537382,21587,COSY HOUR GIANT TUBE MATCHES,2,12/6/2010 13:13,2.55,16710,United Kingdom
537382,84692,BOX OF 24 COCKTAIL PARASOLS,6,12/6/2010 13:13,0.42,16710,United Kingdom
537382,22075,6 RIBBONS ELEGANT CHRISTMAS ,4,12/6/2010 13:13,1.65,16710,United Kingdom
537382,20979,36 PENCILS TUBE RED RETROSPOT,2,12/6/2010 13:13,1.25,16710,United Kingdom
537382,20975,12 PENCILS SMALL TUBE RED RETROSPOT,2,12/6/2010 13:13,0.65,16710,United Kingdom
537382,22445,PENCIL CASE LIFE IS BEAUTIFUL,2,12/6/2010 13:13,2.95,16710,United Kingdom
537382,21644,ASSORTED TUTTI FRUTTI HEART BOX,2,12/6/2010 13:13,1.25,16710,United Kingdom
537382,84625A,PINK NEW BAROQUECANDLESTICK CANDLE,4,12/6/2010 13:13,2.95,16710,United Kingdom
537382,21744,SNOWFLAKE PORTABLE TABLE LIGHT ,4,12/6/2010 13:13,2.95,16710,United Kingdom
537382,22834,HAND WARMER BABUSHKA DESIGN,7,12/6/2010 13:13,2.1,16710,United Kingdom
537382,22866,HAND WARMER SCOTTY DOG DESIGN,7,12/6/2010 13:13,2.1,16710,United Kingdom
537382,22632,HAND WARMER RED RETROSPOT,4,12/6/2010 13:13,2.1,16710,United Kingdom
537382,22867,HAND WARMER BIRD DESIGN,4,12/6/2010 13:13,2.1,16710,United Kingdom
537382,22906,12 MESSAGE CARDS WITH ENVELOPES,4,12/6/2010 13:13,1.65,16710,United Kingdom
537382,22086,PAPER CHAIN KIT 50'S CHRISTMAS ,6,12/6/2010 13:13,2.95,16710,United Kingdom
537382,85231B,CINAMMON SET OF 9 T-LIGHTS,4,12/6/2010 13:13,0.85,16710,United Kingdom
537382,20668,DISCO BALL CHRISTMAS DECORATION,24,12/6/2010 13:13,0.12,16710,United Kingdom
537382,85231G,ORANGE SCENTED SET/9 T-LIGHTS,3,12/6/2010 13:13,0.85,16710,United Kingdom
537382,22842,BISCUIT TIN VINTAGE RED,1,12/6/2010 13:13,6.75,16710,United Kingdom
537382,22739,RIBBON REEL CHRISTMAS SOCK BAUBLE,3,12/6/2010 13:13,1.65,16710,United Kingdom
537382,22736,RIBBON REEL MAKING SNOWMEN ,3,12/6/2010 13:13,1.65,16710,United Kingdom
537382,22753,SMALL YELLOW BABUSHKA NOTEBOOK ,1,12/6/2010 13:13,0.85,16710,United Kingdom
537382,22754,SMALL RED BABUSHKA NOTEBOOK ,1,12/6/2010 13:13,0.85,16710,United Kingdom
537382,22754,SMALL RED BABUSHKA NOTEBOOK ,1,12/6/2010 13:13,0.85,16710,United Kingdom
537382,22755,SMALL PURPLE BABUSHKA NOTEBOOK ,2,12/6/2010 13:13,0.85,16710,United Kingdom
537382,21018,BIRD BOX CHRISTMAS TREE DECORATION,1,12/6/2010 13:13,0.85,16710,United Kingdom
537382,22843,BISCUIT TIN VINTAGE GREEN,1,12/6/2010 13:13,6.75,16710,United Kingdom
537382,21018,BIRD BOX CHRISTMAS TREE DECORATION,3,12/6/2010 13:13,0.85,16710,United Kingdom
537382,35953,FOLKART STAR CHRISTMAS DECORATIONS,1,12/6/2010 13:13,1.25,16710,United Kingdom
537382,35953,FOLKART STAR CHRISTMAS DECORATIONS,1,12/6/2010 13:13,1.25,16710,United Kingdom
537382,21817,GLITTER CHRISTMAS TREE,3,12/6/2010 13:13,0.85,16710,United Kingdom
537382,21818,GLITTER CHRISTMAS HEART ,2,12/6/2010 13:13,0.85,16710,United Kingdom
537382,21811,CHRISTMAS HANGING HEART WITH BELL,1,12/6/2010 13:13,1.25,16710,United Kingdom
537382,22336,DOVE DECORATION PAINTED ZINC ,3,12/6/2010 13:13,0.65,16710,United Kingdom
537382,21818,GLITTER CHRISTMAS HEART ,2,12/6/2010 13:13,0.85,16710,United Kingdom
537382,21819,GLITTER CHRISTMAS STAR ,2,12/6/2010 13:13,0.85,16710,United Kingdom
537382,21811,CHRISTMAS HANGING HEART WITH BELL,1,12/6/2010 13:13,1.25,16710,United Kingdom
537382,85199S,SMALL HANGING IVORY/RED WOOD BIRD,2,12/6/2010 13:13,0.42,16710,United Kingdom
537382,22572,ROCKING HORSE GREEN CHRISTMAS ,6,12/6/2010 13:13,0.85,16710,United Kingdom
537382,22335,HEART DECORATION PAINTED ZINC ,2,12/6/2010 13:13,0.65,16710,United Kingdom
537382,22295,HEART FILIGREE DOVE LARGE,1,12/6/2010 13:13,1.65,16710,United Kingdom
537382,22988,SOLDIERS EGG CUP ,12,12/6/2010 13:13,1.25,16710,United Kingdom
537382,22810,SET OF 6 T-LIGHTS SNOWMEN,6,12/6/2010 13:13,2.95,16710,United Kingdom
537382,22912,YELLOW COAT RACK PARIS FASHION,6,12/6/2010 13:13,4.95,16710,United Kingdom
C537383,21658,GLASS  BEURRE DISH,-1,12/6/2010 13:17,3.95,16550,United Kingdom
C537383,22197,SMALL POPCORN HOLDER,-1,12/6/2010 13:17,0.85,16550,United Kingdom
C537383,22371,AIRLINE BAG VINTAGE TOKYO 78,-1,12/6/2010 13:17,4.25,16550,United Kingdom
537384,22633,HAND WARMER UNION JACK,10,12/6/2010 13:21,2.1,15984,United Kingdom
537384,22632,HAND WARMER RED RETROSPOT,20,12/6/2010 13:21,2.1,15984,United Kingdom
537384,22867,HAND WARMER BIRD DESIGN,10,12/6/2010 13:21,2.1,15984,United Kingdom
537384,22865,HAND WARMER OWL DESIGN,10,12/6/2010 13:21,2.1,15984,United Kingdom
537384,22086,PAPER CHAIN KIT 50'S CHRISTMAS ,6,12/6/2010 13:21,2.95,15984,United Kingdom
537385,22423,REGENCY CAKESTAND 3 TIER,4,12/6/2010 13:22,12.75,14487,United Kingdom
537385,22966,GINGERBREAD MAN COOKIE CUTTER,1,12/6/2010 13:22,1.25,14487,United Kingdom
537385,22633,HAND WARMER UNION JACK,2,12/6/2010 13:22,2.1,14487,United Kingdom
537385,22866,HAND WARMER SCOTTY DOG DESIGN,2,12/6/2010 13:22,2.1,14487,United Kingdom
537385,22867,HAND WARMER BIRD DESIGN,2,12/6/2010 13:22,2.1,14487,United Kingdom
537385,84378,SET OF 3 HEART COOKIE CUTTERS,1,12/6/2010 13:22,1.25,14487,United Kingdom
537385,22956,36 FOIL HEART CAKE CASES,1,12/6/2010 13:22,2.1,14487,United Kingdom
537385,22296,HEART IVORY TRELLIS LARGE,8,12/6/2010 13:22,1.65,14487,United Kingdom
537385,22699,ROSES REGENCY TEACUP AND SAUCER ,6,12/6/2010 13:22,2.95,14487,United Kingdom
537385,22697,GREEN REGENCY TEACUP AND SAUCER,6,12/6/2010 13:22,2.95,14487,United Kingdom
537385,22111,SCOTTIE DOG HOT WATER BOTTLE,1,12/6/2010 13:22,4.95,14487,United Kingdom
537385,22195,LARGE HEART MEASURING SPOONS,1,12/6/2010 13:22,1.65,14487,United Kingdom
537385,22909,SET OF 20 VINTAGE CHRISTMAS NAPKINS,2,12/6/2010 13:22,0.85,14487,United Kingdom
537386,22119,PEACE WOODEN BLOCK LETTERS,3,12/6/2010 13:32,6.95,14911,EIRE
537387,22794,SWEETHEART WIRE MAGAZINE RACK,2,12/6/2010 13:34,7.95,13468,United Kingdom
537387,46000P,POLYESTER FILLER PAD 65CMx65CM,2,12/6/2010 13:34,4.25,13468,United Kingdom
537387,21638,ASSORTED TUTTI FRUTTI NOTEBOOK,12,12/6/2010 13:34,2.1,13468,United Kingdom
537387,82484,WOOD BLACK BOARD ANT WHITE FINISH,3,12/6/2010 13:34,6.45,13468,United Kingdom
537387,22114,HOT WATER BOTTLE TEA AND SYMPATHY,4,12/6/2010 13:34,3.95,13468,United Kingdom
537387,21165,BEWARE OF THE CAT METAL SIGN ,12,12/6/2010 13:34,1.69,13468,United Kingdom
537387,22465,HANGING METAL STAR LANTERN,12,12/6/2010 13:34,1.65,13468,United Kingdom
537387,71053,WHITE METAL LANTERN,4,12/6/2010 13:34,3.75,13468,United Kingdom
537387,82486,WOOD S/3 CABINET ANT WHITE FINISH,2,12/6/2010 13:34,7.95,13468,United Kingdom
537387,79321,CHILLI LIGHTS,4,12/6/2010 13:34,4.95,13468,United Kingdom
537387,22179,SET 10 LIGHTS NIGHT OWL,2,12/6/2010 13:34,6.75,13468,United Kingdom
537387,22245,"HOOK, 1 HANGER ,MAGIC GARDEN",12,12/6/2010 13:34,0.85,13468,United Kingdom
537387,22423,REGENCY CAKESTAND 3 TIER,1,12/6/2010 13:34,12.75,13468,United Kingdom
537387,84945,MULTI COLOUR SILVER T-LIGHT HOLDER,12,12/6/2010 13:34,0.85,13468,United Kingdom
537388,85123A,WHITE HANGING HEART T-LIGHT HOLDER,12,12/6/2010 13:35,2.95,17682,United Kingdom
537388,84978,HANGING HEART JAR T-LIGHT HOLDER,12,12/6/2010 13:35,1.25,17682,United Kingdom
537388,21260,FIRST AID TIN,12,12/6/2010 13:35,3.25,17682,United Kingdom
537388,22457,NATURAL SLATE HEART CHALKBOARD ,6,12/6/2010 13:35,2.95,17682,United Kingdom
537388,21790,VINTAGE SNAP CARDS,12,12/6/2010 13:35,0.85,17682,United Kingdom
537388,21888,BINGO SET,4,12/6/2010 13:35,3.75,17682,United Kingdom
537388,20725,LUNCH BAG RED RETROSPOT,20,12/6/2010 13:35,1.65,17682,United Kingdom
537388,20726,LUNCH BAG WOODLAND,10,12/6/2010 13:35,1.65,17682,United Kingdom
537388,20727,LUNCH BAG  BLACK SKULL.,20,12/6/2010 13:35,1.65,17682,United Kingdom
537388,20728,LUNCH BAG CARS BLUE,10,12/6/2010 13:35,1.65,17682,United Kingdom
537388,22382,LUNCH BAG SPACEBOY DESIGN ,10,12/6/2010 13:35,1.65,17682,United Kingdom
537388,22383,LUNCH BAG SUKI  DESIGN ,10,12/6/2010 13:35,1.65,17682,United Kingdom
537388,22384,LUNCH BAG PINK POLKADOT,20,12/6/2010 13:35,1.65,17682,United Kingdom
537388,22469,HEART OF WICKER SMALL,12,12/6/2010 13:35,1.65,17682,United Kingdom
537388,22470,HEART OF WICKER LARGE,6,12/6/2010 13:35,2.95,17682,United Kingdom
537388,22662,LUNCH BAG DOLLY GIRL DESIGN,10,12/6/2010 13:35,1.65,17682,United Kingdom
537388,82583,HOT BATHS METAL SIGN,12,12/6/2010 13:35,2.1,17682,United Kingdom
537388,22674,FRENCH TOILET SIGN BLUE METAL,12,12/6/2010 13:35,1.25,17682,United Kingdom
537389,21754,HOME BUILDING BLOCK WORD,1,12/6/2010 13:41,5.95,17757,United Kingdom
537389,22867,HAND WARMER BIRD DESIGN,3,12/6/2010 13:41,2.1,17757,United Kingdom
537389,22632,HAND WARMER RED RETROSPOT,5,12/6/2010 13:41,2.1,17757,United Kingdom
537389,22865,HAND WARMER OWL DESIGN,6,12/6/2010 13:41,2.1,17757,United Kingdom
537389,22086,PAPER CHAIN KIT 50'S CHRISTMAS ,10,12/6/2010 13:41,2.95,17757,United Kingdom
537389,21528,DAIRY MAID TRADITIONAL TEAPOT ,1,12/6/2010 13:41,6.95,17757,United Kingdom
537389,22670,FRENCH WC SIGN BLUE METAL,1,12/6/2010 13:41,1.25,17757,United Kingdom
537389,22681,FRENCH BLUE METAL DOOR SIGN 6,1,12/6/2010 13:41,1.25,17757,United Kingdom
537389,22671,FRENCH LAUNDRY SIGN BLUE METAL,2,12/6/2010 13:41,1.65,17757,United Kingdom
537389,21156,RETROSPOT CHILDRENS APRON,2,12/6/2010 13:41,1.95,17757,United Kingdom
537389,22812,PACK 3 BOXES CHRISTMAS PANNETONE,2,12/6/2010 13:41,1.95,17757,United Kingdom
537389,21746,SMALL RED RETROSPOT WINDMILL,1,12/6/2010 13:41,1.25,17757,United Kingdom
537389,21407,BROWN CHECK CAT DOORSTOP ,1,12/6/2010 13:41,4.25,17757,United Kingdom
537389,22198,LARGE POPCORN HOLDER ,3,12/6/2010 13:41,1.65,17757,United Kingdom
537389,22197,SMALL POPCORN HOLDER,10,12/6/2010 13:41,0.85,17757,United Kingdom
537389,84916,HAND TOWEL PALE BLUE W FLOWERS,1,12/6/2010 13:41,5.95,17757,United Kingdom
537389,20752,BLUE POLKADOT WASHING UP GLOVES,4,12/6/2010 13:41,2.1,17757,United Kingdom
537389,21260,FIRST AID TIN,2,12/6/2010 13:41,3.25,17757,United Kingdom
537389,22502,PICNIC BASKET WICKER SMALL,4,12/6/2010 13:41,5.95,17757,United Kingdom
537390,22816,CARD MOTORBIKE SANTA,12,12/6/2010 13:47,0.42,16658,United Kingdom
537390,40005B,BLUE ORGANDY ROUND LAMPSHADE W BEA,1,12/6/2010 13:47,0.85,16658,United Kingdom
537390,47580,TEA TIME DES TEA COSY,1,12/6/2010 13:47,2.55,16658,United Kingdom
537390,18094C,WHITE AND BLUE CERAMIC OIL BURNER,1,12/6/2010 13:47,1.25,16658,United Kingdom
537390,84946,ANTIQUE SILVER TEA GLASS ETCHED,6,12/6/2010 13:47,1.25,16658,United Kingdom
537390,22456,NATURAL SLATE CHALKBOARD LARGE ,1,12/6/2010 13:47,4.95,16658,United Kingdom
537390,21730,GLASS STAR FROSTED T-LIGHT HOLDER,14,12/6/2010 13:47,4.95,16658,United Kingdom
537390,85048,15CM CHRISTMAS GLASS BALL 20 LIGHTS,4,12/6/2010 13:47,7.95,16658,United Kingdom
537391,22423,REGENCY CAKESTAND 3 TIER,3,12/6/2010 13:53,12.75,16550,United Kingdom
537391,22627,MINT KITCHEN SCALES,2,12/6/2010 13:53,8.5,16550,United Kingdom
537391,22624,IVORY KITCHEN SCALES,2,12/6/2010 13:53,8.5,16550,United Kingdom
537391,22626,BLACK KITCHEN SCALES,2,12/6/2010 13:53,8.5,16550,United Kingdom
537391,22910,PAPER CHAIN KIT VINTAGE CHRISTMAS,8,12/6/2010 13:53,2.95,16550,United Kingdom
537391,22142,CHRISTMAS CRAFT WHITE FAIRY ,6,12/6/2010 13:53,1.45,16550,United Kingdom
537391,22144,CHRISTMAS CRAFT LITTLE FRIENDS,5,12/6/2010 13:53,2.1,16550,United Kingdom
537391,22667,RECIPE BOX RETROSPOT ,4,12/6/2010 13:53,2.95,16550,United Kingdom
537391,22666,RECIPE BOX PANTRY YELLOW DESIGN,4,12/6/2010 13:53,2.95,16550,United Kingdom
537391,22665,RECIPE BOX BLUE SKETCHBOOK DESIGN,4,12/6/2010 13:53,2.95,16550,United Kingdom
537391,21098,CHRISTMAS TOILET ROLL,9,12/6/2010 13:53,1.25,16550,United Kingdom
537391,22952,60 CAKE CASES VINTAGE CHRISTMAS,8,12/6/2010 13:53,0.55,16550,United Kingdom
537391,22905,CALENDAR IN SEASON DESIGN,4,12/6/2010 13:53,2.95,16550,United Kingdom
537391,22904,CALENDAR PAPER CUT DESIGN,4,12/6/2010 13:53,2.95,16550,United Kingdom
537391,22911,PAPER CHAIN KIT LONDON,4,12/6/2010 13:53,2.95,16550,United Kingdom
537391,22938,CUPCAKE LACE PAPER SET 6,8,12/6/2010 13:53,1.95,16550,United Kingdom
537391,22906,12 MESSAGE CARDS WITH ENVELOPES,10,12/6/2010 13:53,1.65,16550,United Kingdom
537391,22197,SMALL POPCORN HOLDER,25,12/6/2010 13:53,0.85,16550,United Kingdom
537391,20754,RETROSPOT RED WASHING UP GLOVES,4,12/6/2010 13:53,2.1,16550,United Kingdom
537391,20752,BLUE POLKADOT WASHING UP GLOVES,4,12/6/2010 13:53,2.1,16550,United Kingdom
537391,20751,FUNKY WASHING UP GLOVES ASSORTED,4,12/6/2010 13:53,2.1,16550,United Kingdom
537391,22956,36 FOIL HEART CAKE CASES,6,12/6/2010 13:53,2.1,16550,United Kingdom
537391,22955,36 FOIL STAR CAKE CASES ,6,12/6/2010 13:53,2.1,16550,United Kingdom
537391,22953,BIRTHDAY PARTY CORDON BARRIER TAPE,4,12/6/2010 13:53,1.25,16550,United Kingdom
537391,21558,SKULL LUNCH BOX WITH CUTLERY ,6,12/6/2010 13:53,2.55,16550,United Kingdom
537391,22352,LUNCH BOX WITH CUTLERY RETROSPOT ,6,12/6/2010 13:53,2.55,16550,United Kingdom
537391,21240,BLUE POLKADOT CUP,12,12/6/2010 13:53,0.85,16550,United Kingdom
537391,21239,PINK  POLKADOT CUP,7,12/6/2010 13:53,0.85,16550,United Kingdom
537391,21238,RED RETROSPOT CUP,6,12/6/2010 13:53,0.85,16550,United Kingdom
537391,21559,STRAWBERRY LUNCH BOX WITH CUTLERY,6,12/6/2010 13:53,2.55,16550,United Kingdom
537391,21355,TOAST ITS - I LOVE YOU ,3,12/6/2010 13:53,1.25,16550,United Kingdom
537391,21354,TOAST ITS - BEST MUM,3,12/6/2010 13:53,1.25,16550,United Kingdom
537391,21357,TOAST ITS - DINOSAUR,3,12/6/2010 13:53,1.25,16550,United Kingdom
537391,21356,TOAST ITS - FAIRY FLOWER,3,12/6/2010 13:53,1.25,16550,United Kingdom
537391,22086,PAPER CHAIN KIT 50'S CHRISTMAS ,8,12/6/2010 13:53,2.95,16550,United Kingdom
537391,22371,AIRLINE BAG VINTAGE TOKYO 78,1,12/6/2010 13:53,4.25,16550,United Kingdom
537391,22965,3 TRADITIONAl BISCUIT CUTTERS  SET,4,12/6/2010 13:53,2.1,16550,United Kingdom
537391,82578,KITCHEN METAL SIGN,3,12/6/2010 13:53,0.55,16550,United Kingdom
537391,82580,BATHROOM METAL SIGN,3,12/6/2010 13:53,0.55,16550,United Kingdom
537391,82581,TOILET METAL SIGN,3,12/6/2010 13:53,0.55,16550,United Kingdom
537391,22890,NOVELTY BISCUITS CAKE STAND 3 TIER,2,12/6/2010 13:53,9.95,16550,United Kingdom
537391,22457,NATURAL SLATE HEART CHALKBOARD ,5,12/6/2010 13:53,2.95,16550,United Kingdom
537391,22185,SLATE TILE NATURAL HANGING,5,12/6/2010 13:53,1.65,16550,United Kingdom
537391,21381,MINI WOODEN HAPPY BIRTHDAY GARLAND,4,12/6/2010 13:53,1.69,16550,United Kingdom
537391,21380,WOODEN HAPPY BIRTHDAY GARLAND,4,12/6/2010 13:53,2.95,16550,United Kingdom
537391,22966,GINGERBREAD MAN COOKIE CUTTER,8,12/6/2010 13:53,1.25,16550,United Kingdom
537391,21658,GLASS  BEURRE DISH,4,12/6/2010 13:53,3.95,16550,United Kingdom
537391,22964,3 PIECE SPACEBOY COOKIE CUTTER SET,8,12/6/2010 13:53,2.1,16550,United Kingdom
537392,M,Manual,5,12/6/2010 13:58,1.25,17068,United Kingdom
537392,21481,FAWN BLUE HOT WATER BOTTLE,4,12/6/2010 13:58,2.95,17068,United Kingdom
537392,22694,WICKER STAR ,3,12/6/2010 13:58,2.1,17068,United Kingdom
537392,85099F,JUMBO BAG STRAWBERRY,5,12/6/2010 13:58,1.95,17068,United Kingdom
537392,21931,JUMBO STORAGE BAG SUKI,5,12/6/2010 13:58,1.95,17068,United Kingdom
537392,85099B,JUMBO BAG RED RETROSPOT,6,12/6/2010 13:58,1.95,17068,United Kingdom
537392,21429,RED GINGHAM ROSE JEWELLERY BOX,5,12/6/2010 13:58,1.65,17068,United Kingdom
537392,22470,HEART OF WICKER LARGE,3,12/6/2010 13:58,2.95,17068,United Kingdom
537392,22665,RECIPE BOX BLUE SKETCHBOOK DESIGN,1,12/6/2010 13:58,2.95,17068,United Kingdom
537392,22666,RECIPE BOX PANTRY YELLOW DESIGN,1,12/6/2010 13:58,2.95,17068,United Kingdom
537392,22667,RECIPE BOX RETROSPOT ,2,12/6/2010 13:58,2.95,17068,United Kingdom
537392,22371,AIRLINE BAG VINTAGE TOKYO 78,1,12/6/2010 13:58,4.25,17068,United Kingdom
537392,22469,HEART OF WICKER SMALL,3,12/6/2010 13:58,1.65,17068,United Kingdom
537392,84030E,ENGLISH ROSE HOT WATER BOTTLE,1,12/6/2010 13:58,4.25,17068,United Kingdom
537392,22112,CHOCOLATE HOT WATER BOTTLE,1,12/6/2010 13:58,4.95,17068,United Kingdom
537392,22111,SCOTTIE DOG HOT WATER BOTTLE,1,12/6/2010 13:58,4.95,17068,United Kingdom
537392,21485,RETROSPOT HEART HOT WATER BOTTLE,1,12/6/2010 13:58,4.95,17068,United Kingdom
537392,22382,LUNCH BAG SPACEBOY DESIGN ,5,12/6/2010 13:58,1.65,17068,United Kingdom
537392,22383,LUNCH BAG SUKI  DESIGN ,5,12/6/2010 13:58,1.65,17068,United Kingdom
537392,22367,CHILDRENS APRON SPACEBOY DESIGN,2,12/6/2010 13:58,1.95,17068,United Kingdom
537392,20726,LUNCH BAG WOODLAND,5,12/6/2010 13:58,1.65,17068,United Kingdom
537392,20728,LUNCH BAG CARS BLUE,5,12/6/2010 13:58,1.65,17068,United Kingdom
537392,20727,LUNCH BAG  BLACK SKULL.,5,12/6/2010 13:58,1.65,17068,United Kingdom
537392,20725,LUNCH BAG RED RETROSPOT,5,12/6/2010 13:58,1.65,17068,United Kingdom
537393,21471,STRAWBERRY RAFFIA FOOD COVER,6,12/6/2010 13:59,3.75,13089,United Kingdom
537393,85014A,BLACK/BLUE POLKADOT UMBRELLA,6,12/6/2010 13:59,5.95,13089,United Kingdom
537393,72760B,VINTAGE CREAM 3 BASKET CAKE STAND,2,12/6/2010 13:59,9.95,13089,United Kingdom
537393,84946,ANTIQUE SILVER TEA GLASS ETCHED,36,12/6/2010 13:59,1.25,13089,United Kingdom
537393,47570B,TEA TIME TABLE CLOTH,2,12/6/2010 13:59,10.65,13089,United Kingdom
537393,21445,12 PINK ROSE PEG PLACE SETTINGS,12,12/6/2010 13:59,1.25,13089,United Kingdom
537393,21447,12 IVORY ROSE PEG PLACE SETTINGS,12,12/6/2010 13:59,1.25,13089,United Kingdom
537393,22837,HOT WATER BOTTLE BABUSHKA ,24,12/6/2010 13:59,4.65,13089,United Kingdom
537393,22909,SET OF 20 VINTAGE CHRISTMAS NAPKINS,24,12/6/2010 13:59,0.85,13089,United Kingdom
537393,84029E,RED WOOLLY HOTTIE WHITE HEART.,24,12/6/2010 13:59,3.39,13089,United Kingdom
537393,85123A,WHITE HANGING HEART T-LIGHT HOLDER,32,12/6/2010 13:59,2.55,13089,United Kingdom
537393,84879,ASSORTED COLOUR BIRD ORNAMENT,48,12/6/2010 13:59,1.69,13089,United Kingdom
537393,82483,WOOD 2 DRAWER CABINET WHITE FINISH,16,12/6/2010 13:59,4.95,13089,United Kingdom
537393,22867,HAND WARMER BIRD DESIGN,96,12/6/2010 13:59,1.85,13089,United Kingdom
537393,22865,HAND WARMER OWL DESIGN,96,12/6/2010 13:59,1.85,13089,United Kingdom
537393,22835,HOT WATER BOTTLE I AM SO POORLY,24,12/6/2010 13:59,4.25,13089,United Kingdom
537393,22834,HAND WARMER BABUSHKA DESIGN,48,12/6/2010 13:59,2.1,13089,United Kingdom
537393,22694,WICKER STAR ,24,12/6/2010 13:59,2.1,13089,United Kingdom
537393,22666,RECIPE BOX PANTRY YELLOW DESIGN,24,12/6/2010 13:59,2.55,13089,United Kingdom
537393,22654,DELUXE SEWING KIT ,12,12/6/2010 13:59,5.95,13089,United Kingdom
537393,22653,BUTTON BOX ,24,12/6/2010 13:59,1.95,13089,United Kingdom
537393,22652,TRAVEL SEWING KIT,24,12/6/2010 13:59,1.65,13089,United Kingdom
537393,22633,HAND WARMER UNION JACK,48,12/6/2010 13:59,2.1,13089,United Kingdom
537393,22630,DOLLY GIRL LUNCH BOX,24,12/6/2010 13:59,1.95,13089,United Kingdom
537393,22629,SPACEBOY LUNCH BOX ,24,12/6/2010 13:59,1.95,13089,United Kingdom
537393,22441,GROW YOUR OWN BASIL IN ENAMEL MUG,24,12/6/2010 13:59,2.1,13089,United Kingdom
537393,22178,VICTORIAN GLASS HANGING T-LIGHT,48,12/6/2010 13:59,1.25,13089,United Kingdom
537393,22169,FAMILY ALBUM WHITE PICTURE FRAME,8,12/6/2010 13:59,7.65,13089,United Kingdom
537393,22114,HOT WATER BOTTLE TEA AND SYMPATHY,24,12/6/2010 13:59,3.45,13089,United Kingdom
537393,22112,CHOCOLATE HOT WATER BOTTLE,24,12/6/2010 13:59,4.25,13089,United Kingdom
537393,21874,GIN AND TONIC MUG,24,12/6/2010 13:59,1.25,13089,United Kingdom
537393,21485,RETROSPOT HEART HOT WATER BOTTLE,48,12/6/2010 13:59,4.25,13089,United Kingdom
537393,21481,FAWN BLUE HOT WATER BOTTLE,36,12/6/2010 13:59,2.55,13089,United Kingdom
537393,21479,WHITE SKULL HOT WATER BOTTLE ,24,12/6/2010 13:59,3.39,13089,United Kingdom
537394,22558,CLOTHES PEGS RETROSPOT PACK 24 ,12,12/6/2010 14:00,1.49,13089,United Kingdom
537394,22962,JAM JAR WITH PINK LID,12,12/6/2010 14:00,0.85,13089,United Kingdom
537394,22963,JAM JAR WITH GREEN LID,12,12/6/2010 14:00,0.85,13089,United Kingdom
537394,22960,JAM MAKING SET WITH JARS,6,12/6/2010 14:00,4.25,13089,United Kingdom
537394,22961,JAM MAKING SET PRINTED,12,12/6/2010 14:00,1.45,13089,United Kingdom
537395,20983,12 PENCILS TALL TUBE RED RETROSPOT,1,12/6/2010 14:05,0.85,15356,United Kingdom
537395,21100,CHARLIE AND LOLA CHARLOTTE BAG,1,12/6/2010 14:05,1.65,15356,United Kingdom
537395,21479,WHITE SKULL HOT WATER BOTTLE ,2,12/6/2010 14:05,3.75,15356,United Kingdom
537395,84029G,KNITTED UNION FLAG HOT WATER BOTTLE,1,12/6/2010 14:05,3.75,15356,United Kingdom
537395,22114,HOT WATER BOTTLE TEA AND SYMPATHY,1,12/6/2010 14:05,3.95,15356,United Kingdom
537395,22086,PAPER CHAIN KIT 50'S CHRISTMAS ,1,12/6/2010 14:05,2.95,15356,United Kingdom
537395,22804,CANDLEHOLDER PINK HANGING HEART,1,12/6/2010 14:05,2.95,15356,United Kingdom
537395,21558,SKULL LUNCH BOX WITH CUTLERY ,1,12/6/2010 14:05,2.55,15356,United Kingdom
537395,22952,60 CAKE CASES VINTAGE CHRISTMAS,1,12/6/2010 14:05,0.55,15356,United Kingdom
537395,21733,RED HANGING HEART T-LIGHT HOLDER,2,12/6/2010 14:05,2.95,15356,United Kingdom
537395,85123A,WHITE HANGING HEART T-LIGHT HOLDER,2,12/6/2010 14:05,2.95,15356,United Kingdom
537395,84849B,FAIRY SOAP SOAP HOLDER,2,12/6/2010 14:05,1.69,15356,United Kingdom
537395,22909,SET OF 20 VINTAGE CHRISTMAS NAPKINS,2,12/6/2010 14:05,0.85,15356,United Kingdom
537395,22733,3D TRADITIONAL CHRISTMAS STICKERS,2,12/6/2010 14:05,1.25,15356,United Kingdom
537395,22952,60 CAKE CASES VINTAGE CHRISTMAS,1,12/6/2010 14:05,0.55,15356,United Kingdom
537395,20973,12 PENCIL SMALL TUBE WOODLAND,1,12/6/2010 14:05,0.65,15356,United Kingdom
537395,20979,36 PENCILS TUBE RED RETROSPOT,1,12/6/2010 14:05,1.25,15356,United Kingdom
537395,20978,36 PENCILS TUBE SKULLS,2,12/6/2010 14:05,1.25,15356,United Kingdom
537395,20981,12 PENCILS TALL TUBE WOODLAND,1,12/6/2010 14:05,0.85,15356,United Kingdom
537395,20975,12 PENCILS SMALL TUBE RED RETROSPOT,2,12/6/2010 14:05,0.65,15356,United Kingdom
537395,20974,12 PENCILS SMALL TUBE SKULL,3,12/6/2010 14:05,0.65,15356,United Kingdom
537395,20982,12 PENCILS TALL TUBE SKULLS,3,12/6/2010 14:05,0.85,15356,United Kingdom
537395,21175,GIN + TONIC DIET METAL SIGN,2,12/6/2010 14:05,2.1,15356,United Kingdom
537395,82600,NO SINGING METAL SIGN,1,12/6/2010 14:05,2.1,15356,United Kingdom
537395,82599,FANNY'S REST STOPMETAL SIGN,2,12/6/2010 14:05,2.1,15356,United Kingdom
537395,85152,HAND OVER THE CHOCOLATE   SIGN ,2,12/6/2010 14:05,2.1,15356,United Kingdom
537395,22632,HAND WARMER RED RETROSPOT,1,12/6/2010 14:05,2.1,15356,United Kingdom
537395,21169,YOU'RE CONFUSING ME METAL SIGN ,1,12/6/2010 14:05,1.69,15356,United Kingdom
537395,82552,WASHROOM METAL SIGN,1,12/6/2010 14:05,1.45,15356,United Kingdom
537395,82551,LAUNDRY 15C METAL SIGN,1,12/6/2010 14:05,1.45,15356,United Kingdom
537395,21904,HOUSE WRECKING METAL SIGN ,1,12/6/2010 14:05,2.1,15356,United Kingdom
537395,21181,PLEASE ONE PERSON METAL SIGN,1,12/6/2010 14:05,2.1,15356,United Kingdom
537395,21903,MAN FLU METAL SIGN,1,12/6/2010 14:05,2.1,15356,United Kingdom
537395,22911,PAPER CHAIN KIT LONDON,1,12/6/2010 14:05,2.95,15356,United Kingdom
537395,22085,PAPER CHAIN KIT SKULLS ,1,12/6/2010 14:05,2.95,15356,United Kingdom
537395,22659,LUNCH BOX I LOVE LONDON,1,12/6/2010 14:05,1.95,15356,United Kingdom
537395,21872,GLAMOROUS  MUG,2,12/6/2010 14:05,1.25,15356,United Kingdom
537395,21877,HOME SWEET HOME MUG,2,12/6/2010 14:05,1.25,15356,United Kingdom
537395,21870,I CAN ONLY PLEASE ONE PERSON MUG,2,12/6/2010 14:05,1.25,15356,United Kingdom
537395,21876,POTTERING MUG,1,12/6/2010 14:05,1.25,15356,United Kingdom
537395,21870,I CAN ONLY PLEASE ONE PERSON MUG,2,12/6/2010 14:05,1.25,15356,United Kingdom
537395,21874,GIN AND TONIC MUG,3,12/6/2010 14:05,1.25,15356,United Kingdom
537395,22866,HAND WARMER SCOTTY DOG DESIGN,1,12/6/2010 14:05,2.1,15356,United Kingdom
537395,22632,HAND WARMER RED RETROSPOT,1,12/6/2010 14:05,2.1,15356,United Kingdom
537395,22865,HAND WARMER OWL DESIGN,1,12/6/2010 14:05,2.1,15356,United Kingdom
537395,22867,HAND WARMER BIRD DESIGN,2,12/6/2010 14:05,2.1,15356,United Kingdom
537395,22633,HAND WARMER UNION JACK,6,12/6/2010 14:05,2.1,15356,United Kingdom
537395,22630,DOLLY GIRL LUNCH BOX,1,12/6/2010 14:05,1.95,15356,United Kingdom
537395,22659,LUNCH BOX I LOVE LONDON,1,12/6/2010 14:05,1.95,15356,United Kingdom
537395,84924A,WAKE UP COCKEREL CALENDAR SIGN ,1,12/6/2010 14:05,3.75,15356,United Kingdom
537395,22726,ALARM CLOCK BAKELIKE GREEN,1,12/6/2010 14:05,3.75,15356,United Kingdom
537395,22728,ALARM CLOCK BAKELIKE PINK,1,12/6/2010 14:05,3.75,15356,United Kingdom
537395,22730,ALARM CLOCK BAKELIKE IVORY,1,12/6/2010 14:05,3.75,15356,United Kingdom
537396,M,Manual,1,12/6/2010 14:08,35,17223,United Kingdom
537396,20772,GARDEN PATH JOURNAL,1,12/6/2010 14:08,2.55,17223,United Kingdom
537396,22560,TRADITIONAL MODELLING CLAY,3,12/6/2010 14:08,1.25,17223,United Kingdom
537396,22941,CHRISTMAS LIGHTS 10 REINDEER,1,12/6/2010 14:08,8.5,17223,United Kingdom
537396,22942,CHRISTMAS LIGHTS 10 SANTAS ,1,12/6/2010 14:08,8.5,17223,United Kingdom
537396,22415,WHITE TISSUE REAM,1,12/6/2010 14:08,7.95,17223,United Kingdom
537396,22292,HANGING CHICK  YELLOW DECORATION,3,12/6/2010 14:08,1.45,17223,United Kingdom
537396,84879,ASSORTED COLOUR BIRD ORNAMENT,2,12/6/2010 14:08,1.69,17223,United Kingdom
537396,85199S,SMALL HANGING IVORY/RED WOOD BIRD,2,12/6/2010 14:08,0.42,17223,United Kingdom
537396,85199L,LARGE HANGING IVORY & RED WOOD BIRD,7,12/6/2010 14:08,0.65,17223,United Kingdom
537396,21811,CHRISTMAS HANGING HEART WITH BELL,3,12/6/2010 14:08,1.25,17223,United Kingdom
