InvoiceNo,StockCode,Description,Quantity,InvoiceDate,UnitPrice,CustomerID,Country
537626,21171,BATHROOM METAL SIGN ,12,12/7/2010 14:57,1.45,12347,Iceland
537626,22195,LARGE HEART MEASURING SPOONS,12,12/7/2010 14:57,1.65,12347,Iceland
537626,84969,BOX OF 6 ASSORTED COLOUR TEASPOONS,6,12/7/2010 14:57,4.25,12347,Iceland
537626,84997C,BLUE 3 PIECE POLKADOT CUTLERY SET,6,12/7/2010 14:57,3.75,12347,Iceland
537626,84997B,RED 3 PIECE RETROSPOT CUTLERY SET,6,12/7/2010 14:57,3.75,12347,Iceland
537626,84997D,PINK 3 PIECE POLKADOT CUTLERY SET,6,12/7/2010 14:57,3.75,12347,Iceland
537626,22494,EMERGENCY FIRST AID TIN ,12,12/7/2010 14:57,1.25,12347,Iceland
537626,22497,SET OF 2 TINS VINTAGE BATHROOM ,4,12/7/2010 14:57,4.25,12347,Iceland
537626,85232D,SET/3 DECOUPAGE STACKING TINS,3,12/7/2010 14:57,4.95,12347,Iceland
537626,21064,BOOM BOX SPEAKER BOYS,6,12/7/2010 14:57,5.95,12347,Iceland
537626,21731,RED TOADSTOOL LED NIGHT LIGHT,12,12/7/2010 14:57,1.65,12347,Iceland
537626,84558A,3D DOG PICTURE PLAYING CARDS,24,12/7/2010 14:57,2.95,12347,Iceland
537626,20780,BLACK EAR MUFF HEADPHONES,12,12/7/2010 14:57,4.65,12347,Iceland
537626,20782,CAMOUFLAGE EAR MUFF HEADPHONES,6,12/7/2010 14:57,5.49,12347,Iceland
537627,85049A,TRADITIONAL CHRISTMAS RIBBONS,24,12/7/2010 14:58,1.25,14739,United Kingdom
537627,22086,PAPER CHAIN KIT 50'S CHRISTMAS ,40,12/7/2010 14:58,2.55,14739,United Kingdom
537627,22910,PAPER CHAIN KIT VINTAGE CHRISTMAS,40,12/7/2010 14:58,2.55,14739,United Kingdom
537627,21187,WHITE BELL HONEYCOMB PAPER GARLAND ,48,12/7/2010 14:58,1.45,14739,United Kingdom
537627,21916,SET 12 RETRO WHITE CHALK STICKS,24,12/7/2010 14:58,0.42,14739,United Kingdom
537627,21704,BAG 250g SWIRLY MARBLES,72,12/7/2010 14:58,0.72,14739,United Kingdom
537627,85049C,ROMANTIC PINKS RIBBONS ,12,12/7/2010 14:58,1.25,14739,United Kingdom
537627,85049D,BRIGHT BLUES RIBBONS ,12,12/7/2010 14:58,1.25,14739,United Kingdom
537627,85049G,CHOCOLATE BOX RIBBONS ,12,12/7/2010 14:58,1.25,14739,United Kingdom
537627,21586,KINGS CHOICE GIANT TUBE MATCHES,48,12/7/2010 14:58,2.1,14739,United Kingdom
537627,21587,COSY HOUR GIANT TUBE MATCHES,48,12/7/2010 14:58,2.1,14739,United Kingdom
537627,22178,VICTORIAN GLASS HANGING T-LIGHT,96,12/7/2010 14:58,1.06,14739,United Kingdom
537628,22149,FELTCRAFT 6 FLOWER FRIENDS,6,12/7/2010 15:02,2.1,16293,United Kingdom
537628,20972,PINK CREAM FELT CRAFT TRINKET BOX ,12,12/7/2010 15:02,1.25,16293,United Kingdom
537628,21843,RED RETROSPOT CAKE STAND,1,12/7/2010 15:02,10.95,16293,United Kingdom
537628,85066,CREAM SWEETHEART MINI CHEST,2,12/7/2010 15:02,12.75,16293,United Kingdom
537628,21755,LOVE BUILDING BLOCK WORD,3,12/7/2010 15:02,5.95,16293,United Kingdom
537628,22444,GROW YOUR OWN PLANT IN A CAN ,24,12/7/2010 15:02,1.25,16293,United Kingdom
537628,20682,RED RETROSPOT CHILDRENS UMBRELLA,6,12/7/2010 15:02,3.25,16293,United Kingdom
537628,22299,PIG KEYRING WITH LIGHT & SOUND ,24,12/7/2010 15:02,1.25,16293,United Kingdom
537628,22834,HAND WARMER BABUSHKA DESIGN,24,12/7/2010 15:02,2.1,16293,United Kingdom
537628,22867,HAND WARMER BIRD DESIGN,24,12/7/2010 15:02,2.1,16293,United Kingdom
537628,21908,CHOCOLATE THIS WAY METAL SIGN,12,12/7/2010 15:02,2.1,16293,United Kingdom
537628,21175,GIN + TONIC DIET METAL SIGN,12,12/7/2010 15:02,2.1,16293,United Kingdom
537628,84945,MULTI COLOUR SILVER T-LIGHT HOLDER,12,12/7/2010 15:02,0.85,16293,United Kingdom
537628,22804,CANDLEHOLDER PINK HANGING HEART,6,12/7/2010 15:02,2.95,16293,United Kingdom
537628,72349B,SET/6 PURPLE BUTTERFLY T-LIGHTS,12,12/7/2010 15:02,2.1,16293,United Kingdom
537628,72741,GRAND CHOCOLATECANDLE,9,12/7/2010 15:02,1.45,16293,United Kingdom
537629,22762,CUPBOARD 3 DRAWER MA CAMPAGNE,1,12/7/2010 15:03,14.95,17419,United Kingdom
537629,21773,DECORATIVE ROSE BATHROOM BOTTLE,12,12/7/2010 15:03,1.25,17419,United Kingdom
537629,22149,FELTCRAFT 6 FLOWER FRIENDS,6,12/7/2010 15:03,2.1,17419,United Kingdom
537629,20970,PINK FLORAL FELTCRAFT SHOULDER BAG,4,12/7/2010 15:03,3.75,17419,United Kingdom
537629,21231,SWEETHEART CERAMIC TRINKET BOX,12,12/7/2010 15:03,1.25,17419,United Kingdom
537629,84879,ASSORTED COLOUR BIRD ORNAMENT,8,12/7/2010 15:03,1.69,17419,United Kingdom
537629,22470,HEART OF WICKER LARGE,12,12/7/2010 15:03,2.95,17419,United Kingdom
537629,22189,CREAM HEART CARD HOLDER,8,12/7/2010 15:03,3.95,17419,United Kingdom
537629,21212,PACK OF 72 RETROSPOT CAKE CASES,24,12/7/2010 15:03,0.55,17419,United Kingdom
537629,21098,CHRISTMAS TOILET ROLL,24,12/7/2010 15:03,1.25,17419,United Kingdom
537629,22444,GROW YOUR OWN PLANT IN A CAN ,24,12/7/2010 15:03,1.25,17419,United Kingdom
537629,21889,WOODEN BOX OF DOMINOES,12,12/7/2010 15:03,1.25,17419,United Kingdom
537629,21914,BLUE HARMONICA IN BOX ,12,12/7/2010 15:03,1.25,17419,United Kingdom
537629,21915,RED  HARMONICA IN BOX ,12,12/7/2010 15:03,1.25,17419,United Kingdom
537629,85064,CREAM SWEETHEART LETTER RACK,2,12/7/2010 15:03,5.45,17419,United Kingdom
537629,20971,PINK BLUE FELT CRAFT TRINKET BOX,12,12/7/2010 15:03,1.25,17419,United Kingdom
537629,22768,FAMILY PHOTO FRAME CORNICE,2,12/7/2010 15:03,9.95,17419,United Kingdom
537629,22776,SWEETHEART CAKESTAND 3 TIER,4,12/7/2010 15:03,9.95,17419,United Kingdom
537631,22961,JAM MAKING SET PRINTED,12,12/7/2010 15:04,1.45,17419,United Kingdom
C537630,AMAZONFEE,AMAZON FEE,-1,12/7/2010 15:04,13541.33,,United Kingdom
537632,AMAZONFEE,AMAZON FEE,1,12/7/2010 15:08,13541.33,,United Kingdom
537633,22139,RETROSPOT TEA SET CERAMIC 11 PC ,1,12/7/2010 15:14,4.95,,United Kingdom
537633,22752,SET 7 BABUSHKA NESTING BOXES,1,12/7/2010 15:14,8.5,,United Kingdom
537633,85049A,TRADITIONAL CHRISTMAS RIBBONS,1,12/7/2010 15:14,1.25,,United Kingdom
537633,22733,3D TRADITIONAL CHRISTMAS STICKERS,1,12/7/2010 15:14,1.25,,United Kingdom
537633,21054,NURSE'S BAG SOFT TOY,1,12/7/2010 15:14,8.95,,United Kingdom
537634,21617,4 LILY  BOTANICAL DINNER CANDLES,1,12/7/2010 15:15,3.75,16775,United Kingdom
537634,21804,WHITE CHRISTMAS GARLAND STARS TREES,4,12/7/2010 15:15,3.75,16775,United Kingdom
537634,22867,HAND WARMER BIRD DESIGN,4,12/7/2010 15:15,2.1,16775,United Kingdom
537634,21688,SILVER PLATE CANDLE BOWL SMALL,6,12/7/2010 15:15,2.95,16775,United Kingdom
537634,21733,RED HANGING HEART T-LIGHT HOLDER,2,12/7/2010 15:15,2.95,16775,United Kingdom
537634,22470,HEART OF WICKER LARGE,1,12/7/2010 15:15,2.95,16775,United Kingdom
537634,84836,ZINC METAL HEART DECORATION,12,12/7/2010 15:15,1.25,16775,United Kingdom
537634,22118,JOY WOODEN BLOCK LETTERS,1,12/7/2010 15:15,4.95,16775,United Kingdom
537634,82486,WOOD S/3 CABINET ANT WHITE FINISH,1,12/7/2010 15:15,7.95,16775,United Kingdom
537634,22891,TEA FOR ONE POLKADOT,1,12/7/2010 15:15,4.25,16775,United Kingdom
537634,22139,RETROSPOT TEA SET CERAMIC 11 PC ,2,12/7/2010 15:15,4.95,16775,United Kingdom
537634,22835,HOT WATER BOTTLE I AM SO POORLY,5,12/7/2010 15:15,4.65,16775,United Kingdom
537634,21485,RETROSPOT HEART HOT WATER BOTTLE,2,12/7/2010 15:15,4.95,16775,United Kingdom
537634,22508,DOORSTOP RETROSPOT HEART,2,12/7/2010 15:15,3.75,16775,United Kingdom
537634,22114,HOT WATER BOTTLE TEA AND SYMPATHY,5,12/7/2010 15:15,3.95,16775,United Kingdom
537634,22112,CHOCOLATE HOT WATER BOTTLE,5,12/7/2010 15:15,4.95,16775,United Kingdom
537634,22113,GREY HEART HOT WATER BOTTLE,3,12/7/2010 15:15,3.75,16775,United Kingdom
537634,48138,DOORMAT UNION FLAG,5,12/7/2010 15:15,7.95,16775,United Kingdom
537635,22086,PAPER CHAIN KIT 50'S CHRISTMAS ,18,12/7/2010 15:18,2.95,16306,United Kingdom
537635,21494,ROTATING LEAVES T-LIGHT HOLDER,12,12/7/2010 15:18,1.25,16306,United Kingdom
537636,22637,PIGGY BANK RETROSPOT ,16,12/7/2010 15:20,2.55,16950,United Kingdom
537636,84352,SILVER CHRISTMAS TREE BAUBLE STAND ,4,12/7/2010 15:20,14.95,16950,United Kingdom
537636,22822,CREAM WALL PLANTER HEART SHAPED,12,12/7/2010 15:20,5.95,16950,United Kingdom
537637,22835,HOT WATER BOTTLE I AM SO POORLY,1,12/7/2010 15:22,4.65,,United Kingdom
537637,85034A,3 GARDENIA MORRIS BOXED CANDLES,1,12/7/2010 15:22,4.25,,United Kingdom
537637,85034C,3 ROSE MORRIS BOXED CANDLES,1,12/7/2010 15:22,4.25,,United Kingdom
537637,22110,BIRD HOUSE HOT WATER BOTTLE,1,12/7/2010 15:22,2.55,,United Kingdom
537638,10002,INFLATABLE POLITICAL GLOBE ,5,12/7/2010 15:28,1.66,,United Kingdom
537638,10135,COLOURING PENCILS BROWN TUBE,5,12/7/2010 15:28,2.51,,United Kingdom
537638,15039,SANDALWOOD FAN,1,12/7/2010 15:28,1.66,,United Kingdom
537638,15056BL,EDWARDIAN PARASOL BLACK,2,12/7/2010 15:28,12.72,,United Kingdom
537638,15060B,FAIRY CAKE DESIGN UMBRELLA,1,12/7/2010 15:28,8.47,,United Kingdom
537638,16052,TEATIME PUSH DOWN RUBBER,2,12/7/2010 15:28,0.84,,United Kingdom
537638,16219,HOUSE SHAPE PENCIL SHARPENER,1,12/7/2010 15:28,1.7,,United Kingdom
537638,16225,RATTLE SNAKE EGGS,1,12/7/2010 15:28,3.36,,United Kingdom
537638,16235,RECYCLED PENCIL WITH RABBIT ERASER,2,12/7/2010 15:28,0.43,,United Kingdom
537638,16236,KITTY PENCIL ERASERS,6,12/7/2010 15:28,0.43,,United Kingdom
537638,16237,SLEEPING CAT ERASERS,9,12/7/2010 15:28,0.43,,United Kingdom
537638,16238,PARTY TIME PENCIL ERASERS,4,12/7/2010 15:28,0.43,,United Kingdom
537638,17003,BROCADE RING PURSE ,3,12/7/2010 15:28,0.43,,United Kingdom
537638,17012B,ORIGAMI JASMINE INCENSE/CANDLE SET,2,12/7/2010 15:28,2.51,,United Kingdom
537638,17012C,ORIGAMI LAVENDER INCENSE/CANDL SET ,1,12/7/2010 15:28,2.51,,United Kingdom
537638,17012E,ORIGAMI OPIUM INCENSE/CANDLE SET ,3,12/7/2010 15:28,2.51,,United Kingdom
537638,17012F,ORIGAMI SANDLEWOOD INCENSE/CAND SET,1,12/7/2010 15:28,2.51,,United Kingdom
537638,17129F,BLUE GLASS GEMS IN BAG,1,12/7/2010 15:28,1.66,,United Kingdom
537638,18097C,WHITE TALL PORCELAIN T-LIGHT HOLDER,1,12/7/2010 15:28,5.06,,United Kingdom
537638,20653,CHERRY BLOSSOM LUGGAGE TAG,1,12/7/2010 15:28,2.51,,United Kingdom
537638,20665,RED RETROSPOT PURSE ,1,12/7/2010 15:28,5.91,,United Kingdom
537638,20669,RED HEART LUGGAGE TAG,2,12/7/2010 15:28,2.51,,United Kingdom
537638,20674,GREEN POLKADOT BOWL,1,12/7/2010 15:28,2.51,,United Kingdom
537638,20675,BLUE POLKADOT BOWL,1,12/7/2010 15:28,2.51,,United Kingdom
537638,20677,PINK POLKADOT BOWL,2,12/7/2010 15:28,2.51,,United Kingdom
537638,20712,JUMBO BAG WOODLAND ANIMALS,1,12/7/2010 15:28,4.21,,United Kingdom
537638,20713,JUMBO BAG OWLS,2,12/7/2010 15:28,4.21,,United Kingdom
537638,20717,STRAWBERRY SHOPPER BAG,1,12/7/2010 15:28,2.51,,United Kingdom
537638,20719,WOODLAND CHARLOTTE BAG,5,12/7/2010 15:28,1.66,,United Kingdom
537638,20723,STRAWBERRY CHARLOTTE BAG,1,12/7/2010 15:28,1.66,,United Kingdom
537638,20725,LUNCH BAG RED RETROSPOT,1,12/7/2010 15:28,4.21,,United Kingdom
537638,20726,LUNCH BAG WOODLAND,2,12/7/2010 15:28,4.21,,United Kingdom
537638,20727,LUNCH BAG  BLACK SKULL.,1,12/7/2010 15:28,4.21,,United Kingdom
537638,20733,GOLD MINI TAPE MEASURE ,1,12/7/2010 15:28,0.85,,United Kingdom
537638,20735,BLACK MINI TAPE MEASURE ,1,12/7/2010 15:28,0.85,,United Kingdom
537638,20751,FUNKY WASHING UP GLOVES ASSORTED,1,12/7/2010 15:28,4.21,,United Kingdom
537638,20754,RETROSPOT RED WASHING UP GLOVES,3,12/7/2010 15:28,4.21,,United Kingdom
537638,20763,DAISY SKETCHBOOK ,1,12/7/2010 15:28,7.62,,United Kingdom
537638,20772,GARDEN PATH JOURNAL,1,12/7/2010 15:28,5.06,,United Kingdom
537638,20801,LARGE PINK GLASS SUNDAE DISH,2,12/7/2010 15:28,5.06,,United Kingdom
537638,20829,GLITTER HANGING BUTTERFLY STRING,1,12/7/2010 15:28,4.21,,United Kingdom
537638,20839,FRENCH PAISLEY CUSHION COVER ,2,12/7/2010 15:28,9.32,,United Kingdom
537638,20866,BLUE ROSE FABRIC MIRROR,1,12/7/2010 15:28,2.51,,United Kingdom
537638,20867,PINK ROSE FABRIC MIRROR,2,12/7/2010 15:28,2.51,,United Kingdom
537638,20886,BOX OF 9 PEBBLE CANDLES,1,12/7/2010 15:28,4.21,,United Kingdom
537638,20892,SET/3 TALL GLASS CANDLE HOLDER PINK,2,12/7/2010 15:28,25.49,,United Kingdom
537638,20902,VINTAGE KEEPSAKE BOX PARIS DAYS,1,12/7/2010 15:28,12.72,,United Kingdom
537638,20914,SET/5 RED RETROSPOT LID GLASS BOWLS,4,12/7/2010 15:28,5.91,,United Kingdom
537638,20956,PORCELAIN T-LIGHT HOLDERS ASSORTED,1,12/7/2010 15:28,2.51,,United Kingdom
537638,20966,SANDWICH BATH SPONGE,4,12/7/2010 15:28,2.51,,United Kingdom
537638,20971,PINK BLUE FELT CRAFT TRINKET BOX,1,12/7/2010 15:28,2.51,,United Kingdom
537638,20972,PINK CREAM FELT CRAFT TRINKET BOX ,6,12/7/2010 15:28,2.51,,United Kingdom
537638,20973,12 PENCIL SMALL TUBE WOODLAND,3,12/7/2010 15:28,1.28,,United Kingdom
537638,20975,12 PENCILS SMALL TUBE RED RETROSPOT,2,12/7/2010 15:28,1.28,,United Kingdom
537638,20981,12 PENCILS TALL TUBE WOODLAND,1,12/7/2010 15:28,1.66,,United Kingdom
537638,21000,ROSE DU SUD COSMETICS BAG,1,12/7/2010 15:28,3.36,,United Kingdom
537638,21001,ROSE DU SUD WASHBAG ,1,12/7/2010 15:28,4.21,,United Kingdom
537638,21002,ROSE DU SUD DRAWSTRING BAG,2,12/7/2010 15:28,3.36,,United Kingdom
537638,21041,RED RETROSPOT OVEN GLOVE DOUBLE,1,12/7/2010 15:28,5.91,,United Kingdom
537638,21064,BOOM BOX SPEAKER BOYS,1,12/7/2010 15:28,11.87,,United Kingdom
537638,21065,BOOM BOX SPEAKER GIRLS,1,12/7/2010 15:28,11.87,,United Kingdom
537638,21068,VINTAGE BILLBOARD LOVE/HATE MUG,1,12/7/2010 15:28,2.51,,United Kingdom
537638,21069,VINTAGE BILLBOARD TEA MUG,2,12/7/2010 15:28,2.51,,United Kingdom
537638,21098,CHRISTMAS TOILET ROLL,15,12/7/2010 15:28,2.51,,United Kingdom
537638,21107,CREAM SLICE FLANNEL PINK SPOT ,1,12/7/2010 15:28,5.91,,United Kingdom
537638,21108,FAIRY CAKE FLANNEL ASSORTED COLOUR,3,12/7/2010 15:28,5.06,,United Kingdom
537638,21114,LAVENDER SCENTED FABRIC HEART,1,12/7/2010 15:28,11.02,,United Kingdom
537638,21136,PAINTED METAL PEARS ASSORTED,1,12/7/2010 15:28,25.49,,United Kingdom
537638,21147,JINGLE BELLS TREE DECORATION,1,12/7/2010 15:28,2.51,,United Kingdom
537638,21161,KEEP OUT BOYS DOOR HANGER ,2,12/7/2010 15:28,3.36,,United Kingdom
537638,21167,WHITE SAGE INCENSE,1,12/7/2010 15:28,0.43,,United Kingdom
537638,21174,POTTERING IN THE SHED METAL SIGN,3,12/7/2010 15:28,4.21,,United Kingdom
537638,21175,GIN + TONIC DIET METAL SIGN,1,12/7/2010 15:28,4.21,,United Kingdom
537638,21191,LARGE WHITE HONEYCOMB PAPER BELL  ,5,12/7/2010 15:28,4.21,,United Kingdom
537638,21192,WHITE BELL HONEYCOMB PAPER ,2,12/7/2010 15:28,3.36,,United Kingdom
537638,21212,PACK OF 72 RETROSPOT CAKE CASES,6,12/7/2010 15:28,1.28,,United Kingdom
537638,21213,PACK OF 72 SKULL CAKE CASES,2,12/7/2010 15:28,1.28,,United Kingdom
537638,21222,SET/4 BADGES BEETLES,1,12/7/2010 15:28,2.51,,United Kingdom
537638,21224,SET/4 SKULL BADGES,1,12/7/2010 15:28,2.51,,United Kingdom
537638,21231,SWEETHEART CERAMIC TRINKET BOX,8,12/7/2010 15:28,2.51,,United Kingdom
537638,21232,STRAWBERRY CERAMIC TRINKET BOX,6,12/7/2010 15:28,2.51,,United Kingdom
537638,21238,RED RETROSPOT CUP,1,12/7/2010 15:28,1.66,,United Kingdom
537638,21261,GREEN GOOSE FEATHER CHRISTMAS TREE ,1,12/7/2010 15:28,7.62,,United Kingdom
537638,21262,WHITE GOOSE FEATHER CHRISTMAS TREE ,5,12/7/2010 15:28,7.62,,United Kingdom
537638,21265,PINK GOOSE FEATHER TREE 60CM,1,12/7/2010 15:28,5.91,,United Kingdom
537638,21279,VINTAGE KITCHEN PRINT FRUITS,1,12/7/2010 15:28,5.06,,United Kingdom
537638,21281,VINTAGE KITCHEN PRINT SEAFOOD,1,12/7/2010 15:28,5.06,,United Kingdom
537638,21313,GLASS HEART T-LIGHT HOLDER ,3,12/7/2010 15:28,1.66,,United Kingdom
537638,21314,SMALL GLASS HEART TRINKET POT,7,12/7/2010 15:28,4.21,,United Kingdom
537638,21316,SMALL CHUNKY GLASS ROMAN  BOWL,1,12/7/2010 15:28,5.91,,United Kingdom
537638,21327,SKULLS WRITING SET ,1,12/7/2010 15:28,3.36,,United Kingdom
537638,21328,BALLOONS  WRITING SET ,2,12/7/2010 15:28,3.36,,United Kingdom
537638,21352,EUCALYPTUS & PINECONE  WREATH,1,12/7/2010 15:28,5.91,,United Kingdom
537638,21355,TOAST ITS - I LOVE YOU ,1,12/7/2010 15:28,2.51,,United Kingdom
537638,21356,TOAST ITS - FAIRY FLOWER,2,12/7/2010 15:28,2.51,,United Kingdom
537638,21380,WOODEN HAPPY BIRTHDAY GARLAND,1,12/7/2010 15:28,5.91,,United Kingdom
537638,21397,BLUE POLKADOT EGG CUP ,1,12/7/2010 15:28,3.36,,United Kingdom
537638,21407,BROWN CHECK CAT DOORSTOP ,1,12/7/2010 15:28,8.47,,United Kingdom
537638,21413,PERIWINKLE T-LIGHT HOLDER,3,12/7/2010 15:28,2.51,,United Kingdom
537638,21415,CLAM SHELL SMALL ,1,12/7/2010 15:28,4.21,,United Kingdom
537638,21429,RED GINGHAM ROSE JEWELLERY BOX,5,12/7/2010 15:28,3.36,,United Kingdom
537638,21439,BASKET OF TOADSTOOLS,1,12/7/2010 15:28,2.51,,United Kingdom
537638,21441,BLUE BIRDHOUSE DECORATION,1,12/7/2010 15:28,1.66,,United Kingdom
537638,21479,WHITE SKULL HOT WATER BOTTLE ,8,12/7/2010 15:28,7.62,,United Kingdom
537638,21481,FAWN BLUE HOT WATER BOTTLE,3,12/7/2010 15:28,5.91,,United Kingdom
537638,21484,CHICK GREY HOT WATER BOTTLE,1,12/7/2010 15:28,7.62,,United Kingdom
537638,21485,RETROSPOT HEART HOT WATER BOTTLE,3,12/7/2010 15:28,11.02,,United Kingdom
537638,21509,COWBOYS AND INDIANS BIRTHDAY CARD ,1,12/7/2010 15:28,0.85,,United Kingdom
537638,21524,DOORMAT SPOTTY HOME SWEET HOME,1,12/7/2010 15:28,14.43,,United Kingdom
537638,21544,SKULLS  WATER TRANSFER TATTOOS ,1,12/7/2010 15:28,1.66,,United Kingdom
537638,21559,STRAWBERRY LUNCH BOX WITH CUTLERY,1,12/7/2010 15:28,5.06,,United Kingdom
537638,21595,Dad's Cab Electronic Meter,1,12/7/2010 15:28,8.47,,United Kingdom
537638,21626,VINTAGE UNION JACK PENNANT,1,12/7/2010 15:28,4.21,,United Kingdom
537638,21630,FLOOR CUSHION ELEPHANT CARNIVAL,1,12/7/2010 15:28,18.68,,United Kingdom
537638,21641,ASSORTED TUTTI FRUTTI KEYRING BALL,1,12/7/2010 15:28,1.66,,United Kingdom
537638,21648,ASSORTED TUTTI FRUTTI SMALL PURSE,3,12/7/2010 15:28,2.51,,United Kingdom
537638,21666,RIDGED GLASS T-LIGHT HOLDER,1,12/7/2010 15:28,1.66,,United Kingdom
537638,21671,RED SPOT CERAMIC DRAWER KNOB,2,12/7/2010 15:28,2.51,,United Kingdom
537638,21675,BUTTERFLIES STICKERS,1,12/7/2010 15:28,1.66,,United Kingdom
537638,21704,BAG 250g SWIRLY MARBLES,3,12/7/2010 15:28,1.66,,United Kingdom
537638,21705,BAG 500g SWIRLY MARBLES,2,12/7/2010 15:28,3.36,,United Kingdom
537638,21721,CANDY SHOP  STICKER SHEET,1,12/7/2010 15:28,1.66,,United Kingdom
537638,21725,SWEETIES  STICKERS,2,12/7/2010 15:28,1.66,,United Kingdom
537638,21731,RED TOADSTOOL LED NIGHT LIGHT,1,12/7/2010 15:28,3.36,,United Kingdom
537638,21741,COSY SLIPPER SHOES LARGE GREEN,1,12/7/2010 15:28,5.91,,United Kingdom
537638,21744,SNOWFLAKE PORTABLE TABLE LIGHT ,2,12/7/2010 15:28,5.91,,United Kingdom
537638,21754,HOME BUILDING BLOCK WORD,1,12/7/2010 15:28,11.87,,United Kingdom
537638,21756,BATH BUILDING BLOCK WORD,1,12/7/2010 15:28,11.87,,United Kingdom
537638,21773,DECORATIVE ROSE BATHROOM BOTTLE,2,12/7/2010 15:28,2.51,,United Kingdom
537638,21774,DECORATIVE CATS BATHROOM BOTTLE,2,12/7/2010 15:28,2.51,,United Kingdom
537638,21775,DECORATIVE FLORE BATHROOM BOTTLE,1,12/7/2010 15:28,2.51,,United Kingdom
537638,21786,POLKADOT RAIN HAT ,3,12/7/2010 15:28,0.85,,United Kingdom
537638,21787,RAIN PONCHO RETROSPOT,2,12/7/2010 15:28,1.66,,United Kingdom
537638,21790,VINTAGE SNAP CARDS,4,12/7/2010 15:28,1.66,,United Kingdom
537638,21791,VINTAGE HEADS AND TAILS CARD GAME ,2,12/7/2010 15:28,2.51,,United Kingdom
537638,21801,CHRISTMAS TREE DECORATION WITH BELL,22,12/7/2010 15:28,0.43,,United Kingdom
537638,21802,CHRISTMAS TREE HEART DECORATION,33,12/7/2010 15:28,0.43,,United Kingdom
537638,21803,CHRISTMAS TREE STAR DECORATION,16,12/7/2010 15:28,0.43,,United Kingdom
537638,21810,CHRISTMAS HANGING STAR WITH BELL,3,12/7/2010 15:28,2.51,,United Kingdom
537638,21811,CHRISTMAS HANGING HEART WITH BELL,3,12/7/2010 15:28,2.51,,United Kingdom
537638,21815,STAR  T-LIGHT HOLDER ,3,12/7/2010 15:28,2.98,,United Kingdom
537638,21821,GLITTER STAR GARLAND WITH BELLS ,2,12/7/2010 15:28,7.62,,United Kingdom
537638,21826,EIGHT PIECE DINOSAUR SET,2,12/7/2010 15:28,2.51,,United Kingdom
537638,21828,EIGHT PIECE SNAKE  SET,1,12/7/2010 15:28,2.51,,United Kingdom
537638,21832,CHOCOLATE CALCULATOR,1,12/7/2010 15:28,3.36,,United Kingdom
537638,21833,CAMOUFLAGE LED TORCH,6,12/7/2010 15:28,3.36,,United Kingdom
537638,21846,PINK DIAMANTE PEN IN GIFT BOX,7,12/7/2010 15:28,4.21,,United Kingdom
537638,21849,SILVER DIAMANTE PEN IN GIFT BOX,4,12/7/2010 15:28,4.21,,United Kingdom
537638,21850,BLUE  DIAMANTE PEN IN GIFT BOX,3,12/7/2010 15:28,4.21,,United Kingdom
537638,21851,LILAC DIAMANTE PEN IN GIFT BOX,2,12/7/2010 15:28,4.21,,United Kingdom
537638,21865,PINK UNION JACK  PASSPORT COVER ,1,12/7/2010 15:28,4.21,,United Kingdom
537638,21868,POTTING SHED TEA MUG,2,12/7/2010 15:28,3.36,,United Kingdom
537638,21870,I CAN ONLY PLEASE ONE PERSON MUG,1,12/7/2010 15:28,3.36,,United Kingdom
537638,21877,HOME SWEET HOME MUG,1,12/7/2010 15:28,3.36,,United Kingdom
537638,21888,BINGO SET,1,12/7/2010 15:28,7.62,,United Kingdom
537638,21889,WOODEN BOX OF DOMINOES,1,12/7/2010 15:28,2.51,,United Kingdom
537638,21891,TRADITIONAL WOODEN SKIPPING ROPE,1,12/7/2010 15:28,2.51,,United Kingdom
537638,21892,TRADITIONAL WOODEN CATCH CUP GAME ,6,12/7/2010 15:28,2.51,,United Kingdom
537638,21894,POTTING SHED SEED ENVELOPES,2,12/7/2010 15:28,2.51,,United Kingdom
537638,21899,"KEY FOB , GARAGE DESIGN",1,12/7/2010 15:28,1.66,,United Kingdom
537638,21900,"KEY FOB , SHED",1,12/7/2010 15:28,1.66,,United Kingdom
537638,21901,"KEY FOB , BACK DOOR ",1,12/7/2010 15:28,1.66,,United Kingdom
537638,21903,MAN FLU METAL SIGN,1,12/7/2010 15:28,4.21,,United Kingdom
537638,21906,PHARMACIE FIRST AID TIN,2,12/7/2010 15:28,13.57,,United Kingdom
537638,21911,GARDEN METAL SIGN ,1,12/7/2010 15:28,3.36,,United Kingdom
537638,21913,VINTAGE SEASIDE JIGSAW PUZZLES,1,12/7/2010 15:28,7.62,,United Kingdom
537638,21914,BLUE HARMONICA IN BOX ,1,12/7/2010 15:28,2.51,,United Kingdom
537638,21915,RED  HARMONICA IN BOX ,3,12/7/2010 15:28,2.51,,United Kingdom
537638,21918,SET 12 KIDS COLOUR  CHALK STICKS,1,12/7/2010 15:28,0.85,,United Kingdom
537638,21928,JUMBO BAG SCANDINAVIAN PAISLEY,1,12/7/2010 15:28,4.21,,United Kingdom
537638,21931,JUMBO STORAGE BAG SUKI,3,12/7/2010 15:28,4.21,,United Kingdom
537638,21934,SKULL SHOULDER BAG,3,12/7/2010 15:28,3.36,,United Kingdom
537638,21935,SUKI  SHOULDER BAG,4,12/7/2010 15:28,3.36,,United Kingdom
537638,21936,RED RETROSPOT PICNIC BAG,1,12/7/2010 15:28,5.91,,United Kingdom
537638,21937,STRAWBERRY   PICNIC BAG,1,12/7/2010 15:28,5.91,,United Kingdom
537638,21942,SKULLS DESIGN FLANNEL,1,12/7/2010 15:28,1.66,,United Kingdom
537638,21943,CAKES AND RABBITS DESIGN FLANNEL ,1,12/7/2010 15:28,1.66,,United Kingdom
537638,21945,STRAWBERRIES  DESIGN FLANNEL ,2,12/7/2010 15:28,1.66,,United Kingdom
537638,21947,SET OF 6 HEART CHOPSTICKS,1,12/7/2010 15:28,2.51,,United Kingdom
537638,21949,SET OF 6 STRAWBERRY CHOPSTICKS,1,12/7/2010 15:28,2.51,,United Kingdom
537638,21955,DOORMAT UNION JACK GUNS AND ROSES,1,12/7/2010 15:28,14.43,,United Kingdom
537638,21967,PACK OF 12 SKULL TISSUES,1,12/7/2010 15:28,0.85,,United Kingdom
537638,21975,PACK OF 60 DINOSAUR CAKE CASES,2,12/7/2010 15:28,1.28,,United Kingdom
537638,21977,PACK OF 60 PINK PAISLEY CAKE CASES,1,12/7/2010 15:28,1.28,,United Kingdom
537638,21980,PACK OF 12 RED RETROSPOT TISSUES ,1,12/7/2010 15:28,0.85,,United Kingdom
537638,21981,PACK OF 12 WOODLAND TISSUES ,1,12/7/2010 15:28,0.85,,United Kingdom
537638,21982,PACK OF 12 SUKI TISSUES ,6,12/7/2010 15:28,0.85,,United Kingdom
537638,21986,PACK OF 12 PINK POLKADOT TISSUES,2,12/7/2010 15:28,0.85,,United Kingdom
537638,21990,MODERN FLORAL STATIONERY SET,5,12/7/2010 15:28,2.51,,United Kingdom
537638,21991,BOHEMIAN COLLAGE STATIONERY SET,1,12/7/2010 15:28,2.51,,United Kingdom
537638,21992,VINTAGE PAISLEY STATIONERY SET,8,12/7/2010 15:28,2.51,,United Kingdom
537638,21993,FLORAL FOLK STATIONERY SET,2,12/7/2010 15:28,2.51,,United Kingdom
537638,22027,TEA PARTY BIRTHDAY CARD,1,12/7/2010 15:28,0.85,,United Kingdom
537638,22041,"RECORD FRAME 7"" SINGLE SIZE ",1,12/7/2010 15:28,5.06,,United Kingdom
537638,22064,PINK DOUGHNUT TRINKET POT ,2,12/7/2010 15:28,3.36,,United Kingdom
537638,22075,6 RIBBONS ELEGANT CHRISTMAS ,2,12/7/2010 15:28,3.36,,United Kingdom
537638,22076,6 RIBBONS EMPIRE  ,1,12/7/2010 15:28,3.36,,United Kingdom
537638,22077,6 RIBBONS RUSTIC CHARM,2,12/7/2010 15:28,3.36,,United Kingdom
537638,22079,RIBBON REEL HEARTS DESIGN ,1,12/7/2010 15:28,3.36,,United Kingdom
537638,22084,PAPER CHAIN KIT EMPIRE,3,12/7/2010 15:28,5.91,,United Kingdom
537638,22086,PAPER CHAIN KIT 50'S CHRISTMAS ,15,12/7/2010 15:28,5.91,,United Kingdom
537638,22088,PAPER BUNTING COLOURED LACE,1,12/7/2010 15:28,5.91,,United Kingdom
537638,22091,EMPIRE TISSUE BOX,1,12/7/2010 15:28,2.51,,United Kingdom
537638,22095,LADS ONLY TISSUE BOX,1,12/7/2010 15:28,2.51,,United Kingdom
537638,22100,SKULLS SQUARE TISSUE BOX,1,12/7/2010 15:28,2.51,,United Kingdom
537638,22101,MIRROR MOSAIC VOTIVE HOLDER,1,12/7/2010 15:28,2.51,,United Kingdom
537638,22107,PIZZA PLATE IN BOX,2,12/7/2010 15:28,7.62,,United Kingdom
537638,22108,PING! MICROWAVE PLATE,1,12/7/2010 15:28,3.36,,United Kingdom
537638,22109,FULL ENGLISH BREAKFAST PLATE,5,12/7/2010 15:28,7.62,,United Kingdom
537638,22110,BIRD HOUSE HOT WATER BOTTLE,3,12/7/2010 15:28,7.62,,United Kingdom
537638,22111,SCOTTIE DOG HOT WATER BOTTLE,3,12/7/2010 15:28,11.02,,United Kingdom
537638,22113,GREY HEART HOT WATER BOTTLE,1,12/7/2010 15:28,7.62,,United Kingdom
537638,22114,HOT WATER BOTTLE TEA AND SYMPATHY,4,12/7/2010 15:28,8.47,,United Kingdom
537638,22121,NOEL WOODEN BLOCK LETTERS ,1,12/7/2010 15:28,11.87,,United Kingdom
537638,22123,PING MICROWAVE APRON,1,12/7/2010 15:28,5.06,,United Kingdom
537638,22130,PARTY CONE CHRISTMAS DECORATION ,1,12/7/2010 15:28,8.47,,United Kingdom
537638,22132,RED LOVE HEART SHAPE CUP,4,12/7/2010 15:28,1.66,,United Kingdom
537638,22133,PINK LOVE HEART SHAPE CUP,1,12/7/2010 15:28,1.66,,United Kingdom
537638,22135,LADLE LOVE HEART PINK,3,12/7/2010 15:28,0.85,,United Kingdom
537638,22142,CHRISTMAS CRAFT WHITE FAIRY ,1,12/7/2010 15:28,3.36,,United Kingdom
537638,22144,CHRISTMAS CRAFT LITTLE FRIENDS,2,12/7/2010 15:28,4.21,,United Kingdom
