InvoiceNo,StockCode,Description,Quantity,InvoiceDate,UnitPrice,CustomerID,Country
537764,22167, OVAL WALL MIRROR DIAMANTE ,1,12/8/2010 12:06,9.95,16893,United Kingdom
537764,22360,GLASS JAR ENGLISH CONFECTIONERY,2,12/8/2010 12:06,2.95,16893,United Kingdom
537764,22601,CHRISTMAS RETROSPOT ANGEL WOOD,1,12/8/2010 12:06,0.85,16893,United Kingdom
537764,22579,WOODEN TREE CHRISTMAS SCANDINAVIAN,1,12/8/2010 12:06,0.85,16893,United Kingdom
537764,82616B,FRAPPUCINO SCARF KNITTING KIT,1,12/8/2010 12:06,2.95,16893,United Kingdom
537764,22077,6 RIBBONS RUSTIC CHARM,1,12/8/2010 12:06,1.65,16893,United Kingdom
537764,22438,BALLOON ART MAKE YOUR OWN FLOWERS,1,12/8/2010 12:06,1.95,16893,United Kingdom
537764,21929,JUMBO BAG PINK VINTAGE PAISLEY,1,12/8/2010 12:06,1.95,16893,United Kingdom
537764,22386,JUMBO BAG PINK POLKADOT,1,12/8/2010 12:06,1.95,16893,United Kingdom
537764,22960,JAM MAKING SET WITH JARS,1,12/8/2010 12:06,4.25,16893,United Kingdom
537764,22812,PACK 3 BOXES CHRISTMAS PANNETONE,1,12/8/2010 12:06,1.95,16893,United Kingdom
537764,22065,CHRISTMAS PUDDING TRINKET POT ,2,12/8/2010 12:06,1.45,16893,United Kingdom
537764,21136,PAINTED METAL PEARS ASSORTED,1,12/8/2010 12:06,1.69,16893,United Kingdom
537764,22900, SET 2 TEA TOWELS I LOVE LONDON ,1,12/8/2010 12:06,2.95,16893,United Kingdom
537764,22569,FELTCRAFT CUSHION BUTTERFLY,1,12/8/2010 12:06,3.75,16893,United Kingdom
537764,22568,FELTCRAFT CUSHION OWL,1,12/8/2010 12:06,3.75,16893,United Kingdom
537764,85132B,CHARLIE AND LOLA TABLE TINS,1,12/8/2010 12:06,9.95,16893,United Kingdom
537764,20686,DOLLY MIXTURE CHILDREN'S UMBRELLA,1,12/8/2010 12:06,3.25,16893,United Kingdom
537764,22121,NOEL WOODEN BLOCK LETTERS ,1,12/8/2010 12:06,5.95,16893,United Kingdom
537764,22470,HEART OF WICKER LARGE,1,12/8/2010 12:06,2.95,16893,United Kingdom
537764,22469,HEART OF WICKER SMALL,3,12/8/2010 12:06,1.65,16893,United Kingdom
537764,84596F,SMALL MARSHMALLOWS PINK BOWL,1,12/8/2010 12:06,1.25,16893,United Kingdom
537764,22743,MAKE YOUR OWN FLOWERPOWER CARD KIT,1,12/8/2010 12:06,2.95,16893,United Kingdom
537764,84030E,ENGLISH ROSE HOT WATER BOTTLE,1,12/8/2010 12:06,4.25,16893,United Kingdom
537764,47348A,FUSCHIA VOILE POINTY SHOE DEC,1,12/8/2010 12:06,1.95,16893,United Kingdom
537764,22141,CHRISTMAS CRAFT TREE TOP ANGEL,1,12/8/2010 12:06,2.1,16893,United Kingdom
537764,22910,PAPER CHAIN KIT VINTAGE CHRISTMAS,1,12/8/2010 12:06,2.95,16893,United Kingdom
537764,22147,FELTCRAFT BUTTERFLY HEARTS,1,12/8/2010 12:06,1.45,16893,United Kingdom
537764,84031B,CHARLIE LOLA BLUE HOT WATER BOTTLE ,1,12/8/2010 12:06,4.65,16893,United Kingdom
537764,22570,FELTCRAFT CUSHION RABBIT,1,12/8/2010 12:06,3.75,16893,United Kingdom
537764,21034,REX CASH+CARRY JUMBO SHOPPER,4,12/8/2010 12:06,0.95,16893,United Kingdom
537764,84809A,WHITE CHRYSANTHEMUMS ART FLOWER,6,12/8/2010 12:06,2.1,16893,United Kingdom
537765,90214S,"LETTER ""S"" BLING KEY RING",2,12/8/2010 12:08,1.25,14606,United Kingdom
537765,90214C,"LETTER ""C"" BLING KEY RING",1,12/8/2010 12:08,1.25,14606,United Kingdom
537765,90214B,"LETTER ""B"" BLING KEY RING",1,12/8/2010 12:08,1.25,14606,United Kingdom
537765,90214K,"LETTER ""K"" BLING KEY RING",1,12/8/2010 12:08,1.25,14606,United Kingdom
537765,21210,SET OF 72 RETROSPOT PAPER  DOILIES,1,12/8/2010 12:08,1.45,14606,United Kingdom
537765,22480,RED TEA TOWEL CLASSIC DESIGN,1,12/8/2010 12:08,1.25,14606,United Kingdom
537765,85215,ASSORTED CHEESE FRIDGE MAGNETS,6,12/8/2010 12:08,0.65,14606,United Kingdom
537765,21232,STRAWBERRY CERAMIC TRINKET BOX,1,12/8/2010 12:08,1.25,14606,United Kingdom
537765,20749,ASSORTED COLOUR MINI CASES,1,12/8/2010 12:08,7.95,14606,United Kingdom
537765,20733,GOLD MINI TAPE MEASURE ,4,12/8/2010 12:08,0.85,14606,United Kingdom
537765,20735,BLACK MINI TAPE MEASURE ,4,12/8/2010 12:08,0.85,14606,United Kingdom
537765,21306,SET/4 DAISY MIRROR MAGNETS,1,12/8/2010 12:08,2.1,14606,United Kingdom
537765,85039C,S/4 BLACK MINI ROSE CANDLE IN BOWL,1,12/8/2010 12:08,1.65,14606,United Kingdom
537765,22547,MINI JIGSAW DINOSAUR ,1,12/8/2010 12:08,0.42,14606,United Kingdom
537765,21115,ROSE CARAVAN DOORSTOP,1,12/8/2010 12:08,6.75,14606,United Kingdom
537765,22444,GROW YOUR OWN PLANT IN A CAN ,24,12/8/2010 12:08,1.25,14606,United Kingdom
537765,20780,BLACK EAR MUFF HEADPHONES,2,12/8/2010 12:08,5.49,14606,United Kingdom
537765,21136,PAINTED METAL PEARS ASSORTED,1,12/8/2010 12:08,1.69,14606,United Kingdom
537765,22119,PEACE WOODEN BLOCK LETTERS,1,12/8/2010 12:08,6.95,14606,United Kingdom
537765,20770,ABSTRACT CIRCLE JOURNAL ,1,12/8/2010 12:08,2.55,14606,United Kingdom
537765,22296,HEART IVORY TRELLIS LARGE,1,12/8/2010 12:08,1.65,14606,United Kingdom
537765,84988,SET OF 72 PINK HEART PAPER DOILIES,1,12/8/2010 12:08,1.45,14606,United Kingdom
537765,20971,PINK BLUE FELT CRAFT TRINKET BOX,1,12/8/2010 12:08,1.25,14606,United Kingdom
537765,22195,LARGE HEART MEASURING SPOONS,1,12/8/2010 12:08,1.65,14606,United Kingdom
537765,22348,TEA BAG PLATE RED RETROSPOT,2,12/8/2010 12:08,0.85,14606,United Kingdom
537765,20655,QUEEN OF SKIES LUGGAGE TAG,1,12/8/2010 12:08,1.25,14606,United Kingdom
537765,20985,HEART CALCULATOR,1,12/8/2010 12:08,1.25,14606,United Kingdom
537765,21874,GIN AND TONIC MUG,1,12/8/2010 12:08,1.25,14606,United Kingdom
537765,22448,PIN CUSHION BABUSHKA RED,1,12/8/2010 12:08,3.35,14606,United Kingdom
537765,85067,CREAM SWEETHEART WALL CABINET,1,12/8/2010 12:08,18.95,14606,United Kingdom
537765,20996,JAZZ HEARTS ADDRESS BOOK,7,12/8/2010 12:08,0.42,14606,United Kingdom
537765,22326,ROUND SNACK BOXES SET OF4 WOODLAND ,1,12/8/2010 12:08,2.95,14606,United Kingdom
537765,22424,ENAMEL BREAD BIN CREAM,1,12/8/2010 12:08,12.75,14606,United Kingdom
537765,20748,KENSINGTON COFFEE SET,1,12/8/2010 12:08,12.75,14606,United Kingdom
537765,21890,S/6 WOODEN SKITTLES IN COTTON BAG,1,12/8/2010 12:08,2.95,14606,United Kingdom
537765,21686,MEDINA STAMPED METAL STOOL,1,12/8/2010 12:08,39.95,14606,United Kingdom
537765,85014A,BLACK/BLUE POLKADOT UMBRELLA,1,12/8/2010 12:08,5.95,14606,United Kingdom
537765,21784,SHOE SHINE BOX ,1,12/8/2010 12:08,9.95,14606,United Kingdom
537766,22932,BAKING MOULD TOFFEE CUP CHOCOLATE,72,12/8/2010 12:08,2.1,17677,United Kingdom
537766,22935,BAKING MOULD ROSE MILK CHOCOLATE,72,12/8/2010 12:08,2.75,17677,United Kingdom
537766,22931,BAKING MOULD HEART WHITE CHOCOLATE,72,12/8/2010 12:08,2.1,17677,United Kingdom
537766,22930,BAKING MOULD HEART MILK CHOCOLATE,72,12/8/2010 12:08,2.1,17677,United Kingdom
537767,21258,VICTORIAN SEWING BOX LARGE,32,12/8/2010 12:09,10.95,15100,United Kingdom
537768,21930,JUMBO STORAGE BAG SKULLS,10,12/8/2010 12:11,1.95,15750,United Kingdom
537768,85099B,JUMBO BAG RED RETROSPOT,10,12/8/2010 12:11,1.95,15750,United Kingdom
537769,15056BL,EDWARDIAN PARASOL BLACK,2,12/8/2010 12:17,5.95,15021,United Kingdom
537769,22130,PARTY CONE CHRISTMAS DECORATION ,6,12/8/2010 12:17,0.85,15021,United Kingdom
537769,85025C,PINK HEART SHAPE PHOTO FRAME,1,12/8/2010 12:17,1.65,15021,United Kingdom
537769,20828,GLITTER BUTTERFLY CLIPS,1,12/8/2010 12:17,2.55,15021,United Kingdom
537769,21181,PLEASE ONE PERSON METAL SIGN,1,12/8/2010 12:17,2.1,15021,United Kingdom
537769,85208,SET/12 FUNKY FELT FLOWER PEG IN BAG,1,12/8/2010 12:17,2.1,15021,United Kingdom
537769,21307,SET/4 BUTTERFLY MIRROR MAGNETS,1,12/8/2010 12:17,2.1,15021,United Kingdom
537769,22158,3 HEARTS HANGING DECORATION RUSTIC,8,12/8/2010 12:17,2.95,15021,United Kingdom
537769,85024C,PINK SMALL JEWELLED PHOTOFRAME,1,12/8/2010 12:17,1.65,15021,United Kingdom
537769,85123A,WHITE HANGING HEART T-LIGHT HOLDER,1,12/8/2010 12:17,2.95,15021,United Kingdom
537769,22157,ANGEL DECORATION WITH LACE PADDED,3,12/8/2010 12:17,0.85,15021,United Kingdom
537769,22834,HAND WARMER BABUSHKA DESIGN,1,12/8/2010 12:17,2.1,15021,United Kingdom
537769,22867,HAND WARMER BIRD DESIGN,1,12/8/2010 12:17,2.1,15021,United Kingdom
537769,85214,TUB 24 PINK FLOWER PEGS,1,12/8/2010 12:17,1.65,15021,United Kingdom
537769,72802C,VANILLA SCENT CANDLE JEWELLED BOX,1,12/8/2010 12:17,4.25,15021,United Kingdom
537769,82494L,WOODEN FRAME ANTIQUE WHITE ,2,12/8/2010 12:17,2.95,15021,United Kingdom
537769,82482,WOODEN PICTURE FRAME WHITE FINISH,2,12/8/2010 12:17,2.55,15021,United Kingdom
537769,22563,HAPPY STENCIL CRAFT,1,12/8/2010 12:17,1.25,15021,United Kingdom
537769,22626,BLACK KITCHEN SCALES,1,12/8/2010 12:17,8.5,15021,United Kingdom
537769,72802A,ROSE SCENT CANDLE IN JEWELLED BOX,1,12/8/2010 12:17,4.25,15021,United Kingdom
537769,72807A,SET/3 ROSE CANDLE IN JEWELLED BOX,1,12/8/2010 12:17,4.25,15021,United Kingdom
537769,22456,NATURAL SLATE CHALKBOARD LARGE ,1,12/8/2010 12:17,4.95,15021,United Kingdom
537769,85123A,WHITE HANGING HEART T-LIGHT HOLDER,2,12/8/2010 12:17,2.95,15021,United Kingdom
537769,22470,HEART OF WICKER LARGE,1,12/8/2010 12:17,2.95,15021,United Kingdom
537769,21733,RED HANGING HEART T-LIGHT HOLDER,1,12/8/2010 12:17,2.95,15021,United Kingdom
537769,85020,ROUND PINK HEART MIRROR,2,12/8/2010 12:17,2.1,15021,United Kingdom
537769,21558,SKULL LUNCH BOX WITH CUTLERY ,1,12/8/2010 12:17,2.55,15021,United Kingdom
537769,21559,STRAWBERRY LUNCH BOX WITH CUTLERY,1,12/8/2010 12:17,2.55,15021,United Kingdom
537769,21181,PLEASE ONE PERSON METAL SIGN,1,12/8/2010 12:17,2.1,15021,United Kingdom
537769,22564,ALPHABET STENCIL CRAFT,1,12/8/2010 12:17,1.25,15021,United Kingdom
537769,22562,MONSTERS STENCIL CRAFT,1,12/8/2010 12:17,1.25,15021,United Kingdom
537769,22564,ALPHABET STENCIL CRAFT,1,12/8/2010 12:17,1.25,15021,United Kingdom
537769,10120,DOGGY RUBBER,12,12/8/2010 12:17,0.21,15021,United Kingdom
537769,85208,SET/12 FUNKY FELT FLOWER PEG IN BAG,1,12/8/2010 12:17,2.1,15021,United Kingdom
537769,22834,HAND WARMER BABUSHKA DESIGN,4,12/8/2010 12:17,2.1,15021,United Kingdom
537769,20992,JAZZ HEARTS PURSE NOTEBOOK,3,12/8/2010 12:17,0.85,15021,United Kingdom
537769,20996,JAZZ HEARTS ADDRESS BOOK,1,12/8/2010 12:17,0.42,15021,United Kingdom
537769,21947,SET OF 6 HEART CHOPSTICKS,1,12/8/2010 12:17,1.25,15021,United Kingdom
537769,22156,HEART DECORATION WITH PEARLS ,2,12/8/2010 12:17,0.85,15021,United Kingdom
537769,22350,ILLUSTRATED CAT BOWL ,3,12/8/2010 12:17,2.55,15021,United Kingdom
537769,22834,HAND WARMER BABUSHKA DESIGN,1,12/8/2010 12:17,2.1,15021,United Kingdom
537769,22867,HAND WARMER BIRD DESIGN,2,12/8/2010 12:17,2.1,15021,United Kingdom
537769,22189,CREAM HEART CARD HOLDER,1,12/8/2010 12:17,3.95,15021,United Kingdom
537769,22188,BLACK HEART CARD HOLDER,1,12/8/2010 12:17,3.95,15021,United Kingdom
537769,22766,PHOTO FRAME CORNICE,1,12/8/2010 12:17,2.95,15021,United Kingdom
537769,71038,WHITE HANGING BEADS CANDLE HOLDER,2,12/8/2010 12:17,5.45,15021,United Kingdom
537769,22569,FELTCRAFT CUSHION BUTTERFLY,1,12/8/2010 12:17,3.75,15021,United Kingdom
537769,22570,FELTCRAFT CUSHION RABBIT,1,12/8/2010 12:17,3.75,15021,United Kingdom
537769,21889,WOODEN BOX OF DOMINOES,2,12/8/2010 12:17,1.25,15021,United Kingdom
537769,22147,FELTCRAFT BUTTERFLY HEARTS,1,12/8/2010 12:17,1.45,15021,United Kingdom
537769,21407,BROWN CHECK CAT DOORSTOP ,1,12/8/2010 12:17,4.25,15021,United Kingdom
537769,82482,WOODEN PICTURE FRAME WHITE FINISH,1,12/8/2010 12:17,2.55,15021,United Kingdom
537769,71477,COLOUR GLASS. STAR T-LIGHT HOLDER,1,12/8/2010 12:17,3.25,15021,United Kingdom
537770,22044,CHRISTMAS CARD STACK OF PRESENTS,24,12/8/2010 12:24,0.42,15529,United Kingdom
537770,22909,SET OF 20 VINTAGE CHRISTMAS NAPKINS,12,12/8/2010 12:24,0.85,15529,United Kingdom
537770,21197,MULTICOLOUR  CONFETTI IN TUBE,12,12/8/2010 12:24,1.65,15529,United Kingdom
537770,21137,BLACK RECORD COVER FRAME,8,12/8/2010 12:24,3.75,15529,United Kingdom
537770,40016,CHINESE DRAGON PAPER LANTERNS,24,12/8/2010 12:24,0.42,15529,United Kingdom
537770,21935,SUKI  SHOULDER BAG,10,12/8/2010 12:24,1.65,15529,United Kingdom
537770,22902,TOTE BAG I LOVE LONDON,12,12/8/2010 12:24,2.1,15529,United Kingdom
537770,10002,INFLATABLE POLITICAL GLOBE ,12,12/8/2010 12:24,0.85,15529,United Kingdom
537770,21912,VINTAGE SNAKES & LADDERS,8,12/8/2010 12:24,3.75,15529,United Kingdom
537770,22752,SET 7 BABUSHKA NESTING BOXES,2,12/8/2010 12:24,8.5,15529,United Kingdom
537770,22821,GIFT BAG PSYCHEDELIC APPLES,12,12/8/2010 12:24,0.65,15529,United Kingdom
537770,22114,HOT WATER BOTTLE TEA AND SYMPATHY,4,12/8/2010 12:24,3.95,15529,United Kingdom
537770,22111,SCOTTIE DOG HOT WATER BOTTLE,6,12/8/2010 12:24,4.95,15529,United Kingdom
537770,22900, SET 2 TEA TOWELS I LOVE LONDON ,18,12/8/2010 12:24,2.95,15529,United Kingdom
537770,84945,MULTI COLOUR SILVER T-LIGHT HOLDER,12,12/8/2010 12:24,0.85,15529,United Kingdom
537771,21232,STRAWBERRY CERAMIC TRINKET BOX,24,12/8/2010 12:29,1.25,15498,United Kingdom
537771,22174,PHOTO CUBE,48,12/8/2010 12:29,1.48,15498,United Kingdom
537771,21524,DOORMAT SPOTTY HOME SWEET HOME,20,12/8/2010 12:29,6.75,15498,United Kingdom
537771,48173C,DOORMAT BLACK FLOCK ,10,12/8/2010 12:29,6.75,15498,United Kingdom
537771,22688,DOORMAT PEACE ON EARTH BLUE,10,12/8/2010 12:29,6.75,15498,United Kingdom
537771,22158,3 HEARTS HANGING DECORATION RUSTIC,8,12/8/2010 12:29,2.95,15498,United Kingdom
537771,21481,FAWN BLUE HOT WATER BOTTLE,12,12/8/2010 12:29,2.95,15498,United Kingdom
537771,21967,PACK OF 12 SKULL TISSUES,24,12/8/2010 12:29,0.29,15498,United Kingdom
537771,84077,WORLD WAR 2 GLIDERS ASSTD DESIGNS,48,12/8/2010 12:29,0.29,15498,United Kingdom
537772,84613C,BLUE NEW BAROQUE FLOCK CANDLESTICK,1,12/8/2010 12:35,4.65,18043,United Kingdom
537772,22867,HAND WARMER BIRD DESIGN,5,12/8/2010 12:35,2.1,18043,United Kingdom
537772,22813,PACK 3 BOXES BIRD PANNETONE ,1,12/8/2010 12:35,1.95,18043,United Kingdom
537772,22900, SET 2 TEA TOWELS I LOVE LONDON ,2,12/8/2010 12:35,2.95,18043,United Kingdom
537772,16235,RECYCLED PENCIL WITH RABBIT ERASER,3,12/8/2010 12:35,0.21,18043,United Kingdom
537772,22114,HOT WATER BOTTLE TEA AND SYMPATHY,1,12/8/2010 12:35,3.95,18043,United Kingdom
537772,21481,FAWN BLUE HOT WATER BOTTLE,1,12/8/2010 12:35,2.95,18043,United Kingdom
537772,21471,STRAWBERRY RAFFIA FOOD COVER,1,12/8/2010 12:35,3.75,18043,United Kingdom
537772,22629,SPACEBOY LUNCH BOX ,1,12/8/2010 12:35,1.95,18043,United Kingdom
537772,22659,LUNCH BOX I LOVE LONDON,4,12/8/2010 12:35,1.95,18043,United Kingdom
537772,22080,RIBBON REEL POLKADOTS ,5,12/8/2010 12:35,1.65,18043,United Kingdom
537772,22082,RIBBON REEL STRIPES DESIGN ,5,12/8/2010 12:35,1.65,18043,United Kingdom
537772,22371,AIRLINE BAG VINTAGE TOKYO 78,1,12/8/2010 12:35,4.25,18043,United Kingdom
537772,21034,REX CASH+CARRY JUMBO SHOPPER,1,12/8/2010 12:35,0.95,18043,United Kingdom
537772,20676,RED RETROSPOT BOWL,6,12/8/2010 12:35,1.25,18043,United Kingdom
537772,84828,JUNGLE POPSICLES ICE LOLLY HOLDERS,1,12/8/2010 12:35,1.25,18043,United Kingdom
537772,21877,HOME SWEET HOME MUG,1,12/8/2010 12:35,1.25,18043,United Kingdom
537772,22951,60 CAKE CASES DOLLY GIRL DESIGN,1,12/8/2010 12:35,0.55,18043,United Kingdom
537772,22551,PLASTERS IN TIN SPACEBOY,1,12/8/2010 12:35,1.65,18043,United Kingdom
537772,21212,PACK OF 72 RETROSPOT CAKE CASES,2,12/8/2010 12:35,0.55,18043,United Kingdom
537772,22037,ROBOT BIRTHDAY CARD,12,12/8/2010 12:35,0.42,18043,United Kingdom
537772,22983,CARD BILLBOARD FONT,12,12/8/2010 12:35,0.42,18043,United Kingdom
537772,22443,GROW YOUR OWN HERBS SET OF 3,1,12/8/2010 12:35,7.95,18043,United Kingdom
537772,21472,LADYBIRD + BEE RAFFIA FOOD COVER,1,12/8/2010 12:35,3.75,18043,United Kingdom
537772,21467,CHERRY CROCHET FOOD COVER,1,12/8/2010 12:35,3.75,18043,United Kingdom
537772,22092,BLUE PAISLEY TISSUE BOX,1,12/8/2010 12:35,1.25,18043,United Kingdom
537772,22091,EMPIRE TISSUE BOX,1,12/8/2010 12:35,1.25,18043,United Kingdom
537772,22326,ROUND SNACK BOXES SET OF4 WOODLAND ,1,12/8/2010 12:35,2.95,18043,United Kingdom
537772,22898,CHILDRENS APRON APPLES DESIGN,2,12/8/2010 12:35,1.95,18043,United Kingdom
537772,22902,TOTE BAG I LOVE LONDON,2,12/8/2010 12:35,2.1,18043,United Kingdom
537772,22111,SCOTTIE DOG HOT WATER BOTTLE,1,12/8/2010 12:35,4.95,18043,United Kingdom
537772,21479,WHITE SKULL HOT WATER BOTTLE ,1,12/8/2010 12:35,3.75,18043,United Kingdom
537772,21484,CHICK GREY HOT WATER BOTTLE,1,12/8/2010 12:35,3.45,18043,United Kingdom
537772,22867,HAND WARMER BIRD DESIGN,2,12/8/2010 12:35,2.1,18043,United Kingdom
537772,22080,RIBBON REEL POLKADOTS ,5,12/8/2010 12:35,1.65,18043,United Kingdom
537772,22079,RIBBON REEL HEARTS DESIGN ,5,12/8/2010 12:35,1.65,18043,United Kingdom
537772,22636,CHILDS BREAKFAST SET CIRCUS PARADE,2,12/8/2010 12:35,8.5,18043,United Kingdom
537772,22738,RIBBON REEL SNOWY VILLAGE,5,12/8/2010 12:35,1.65,18043,United Kingdom
537772,22560,TRADITIONAL MODELLING CLAY,3,12/8/2010 12:35,1.25,18043,United Kingdom
537772,22328,ROUND SNACK BOXES SET OF 4 FRUITS ,1,12/8/2010 12:35,2.95,18043,United Kingdom
537772,22629,SPACEBOY LUNCH BOX ,2,12/8/2010 12:35,1.95,18043,United Kingdom
537772,22659,LUNCH BOX I LOVE LONDON,4,12/8/2010 12:35,1.95,18043,United Kingdom
537772,22908,PACK OF 20 NAPKINS RED APPLES,2,12/8/2010 12:35,0.85,18043,United Kingdom
537772,21242,RED RETROSPOT PLATE ,6,12/8/2010 12:35,1.69,18043,United Kingdom
537772,84910A,PINK PAISLEY CUSHION COVER ,2,12/8/2010 12:35,5.95,18043,United Kingdom
537772,22940,FELTCRAFT CHRISTMAS FAIRY,1,12/8/2010 12:35,4.25,18043,United Kingdom
537772,22749,FELTCRAFT PRINCESS CHARLOTTE DOLL,1,12/8/2010 12:35,3.75,18043,United Kingdom
537772,22082,RIBBON REEL STRIPES DESIGN ,5,12/8/2010 12:35,1.65,18043,United Kingdom
537772,84912A,PINK ROSE WASHBAG,1,12/8/2010 12:35,3.75,18043,United Kingdom
537772,22276,WASH BAG VINTAGE ROSE PAISLEY,1,12/8/2010 12:35,2.55,18043,United Kingdom
537772,21981,PACK OF 12 WOODLAND TISSUES ,12,12/8/2010 12:35,0.29,18043,United Kingdom
537772,21967,PACK OF 12 SKULL TISSUES,12,12/8/2010 12:35,0.29,18043,United Kingdom
537772,22094,RED RETROSPOT TISSUE BOX,1,12/8/2010 12:35,1.25,18043,United Kingdom
537772,22086,PAPER CHAIN KIT 50'S CHRISTMAS ,1,12/8/2010 12:35,2.95,18043,United Kingdom
537772,85183B,CHARLIE & LOLA WASTEPAPER BIN FLORA,1,12/8/2010 12:35,3.75,18043,United Kingdom
537772,84947,ANTIQUE SILVER TEA GLASS ENGRAVED,4,12/8/2010 12:35,1.25,18043,United Kingdom
537772,22502,PICNIC BASKET WICKER SMALL,1,12/8/2010 12:35,5.95,18043,United Kingdom
537772,22371,AIRLINE BAG VINTAGE TOKYO 78,1,12/8/2010 12:35,4.25,18043,United Kingdom
537772,21080,SET/20 RED RETROSPOT PAPER NAPKINS ,2,12/8/2010 12:35,0.85,18043,United Kingdom
537772,21888,BINGO SET,1,12/8/2010 12:35,3.75,18043,United Kingdom
537772,22750,FELTCRAFT PRINCESS LOLA DOLL,1,12/8/2010 12:35,3.75,18043,United Kingdom
537772,22193,RED DINER WALL CLOCK,1,12/8/2010 12:35,8.5,18043,United Kingdom
537772,22607,WOODEN ROUNDERS GARDEN SET ,1,12/8/2010 12:35,9.95,18043,United Kingdom
537772,22180,RETROSPOT LAMP,1,12/8/2010 12:35,9.95,18043,United Kingdom
537772,22654,DELUXE SEWING KIT ,1,12/8/2010 12:35,5.95,18043,United Kingdom
537772,21034,REX CASH+CARRY JUMBO SHOPPER,2,12/8/2010 12:35,0.95,18043,United Kingdom
537773,20764,ABSTRACT CIRCLES SKETCHBOOK ,1,12/8/2010 12:36,3.75,16016,United Kingdom
537773,20763,DAISY SKETCHBOOK ,1,12/8/2010 12:36,3.75,16016,United Kingdom
537773,20762,GREEN FERN SKETCHBOOK ,1,12/8/2010 12:36,3.75,16016,United Kingdom
537773,20765,CHRYSANTHEMUM SKETCHBOOK ,1,12/8/2010 12:36,3.75,16016,United Kingdom
537773,20766,GARDEN PATH SKETCHBOOK,1,12/8/2010 12:36,3.75,16016,United Kingdom
537773,22622,BOX OF VINTAGE ALPHABET BLOCKS,1,12/8/2010 12:36,9.95,16016,United Kingdom
537773,22386,JUMBO BAG PINK POLKADOT,1,12/8/2010 12:36,1.95,16016,United Kingdom
537773,20712,JUMBO BAG WOODLAND ANIMALS,1,12/8/2010 12:36,1.95,16016,United Kingdom
537773,21578,WOODLAND DESIGN  COTTON TOTE BAG,2,12/8/2010 12:36,2.25,16016,United Kingdom
537773,21891,TRADITIONAL WOODEN SKIPPING ROPE,2,12/8/2010 12:36,1.25,16016,United Kingdom
537773,20973,12 PENCIL SMALL TUBE WOODLAND,4,12/8/2010 12:36,0.65,16016,United Kingdom
537773,22150,3 STRIPEY MICE FELTCRAFT,2,12/8/2010 12:36,1.95,16016,United Kingdom
537773,21484,CHICK GREY HOT WATER BOTTLE,5,12/8/2010 12:36,3.45,16016,United Kingdom
537773,22867,HAND WARMER BIRD DESIGN,5,12/8/2010 12:36,2.1,16016,United Kingdom
537773,20725,LUNCH BAG RED RETROSPOT,1,12/8/2010 12:36,1.65,16016,United Kingdom
537773,22384,LUNCH BAG PINK POLKADOT,1,12/8/2010 12:36,1.65,16016,United Kingdom
537773,22382,LUNCH BAG SPACEBOY DESIGN ,1,12/8/2010 12:36,1.65,16016,United Kingdom
537773,22327,ROUND SNACK BOXES SET OF 4 SKULLS,3,12/8/2010 12:36,2.95,16016,United Kingdom
537773,84497,BUTTONS AND STRIPES NOTEBOOK ,2,12/8/2010 12:36,3.75,16016,United Kingdom
537773,20727,LUNCH BAG  BLACK SKULL.,4,12/8/2010 12:36,1.65,16016,United Kingdom
537773,22326,ROUND SNACK BOXES SET OF4 WOODLAND ,4,12/8/2010 12:36,2.95,16016,United Kingdom
537773,20726,LUNCH BAG WOODLAND,2,12/8/2010 12:36,1.65,16016,United Kingdom
537773,15056N,EDWARDIAN PARASOL NATURAL,2,12/8/2010 12:36,5.95,16016,United Kingdom
537773,22926,IVORY GIANT GARDEN THERMOMETER,1,12/8/2010 12:36,5.95,16016,United Kingdom
537773,22469,HEART OF WICKER SMALL,4,12/8/2010 12:36,1.65,16016,United Kingdom
537773,21991,BOHEMIAN COLLAGE STATIONERY SET,1,12/8/2010 12:36,2.95,16016,United Kingdom
537773,21990,MODERN FLORAL STATIONERY SET,1,12/8/2010 12:36,2.95,16016,United Kingdom
537773,21992,VINTAGE PAISLEY STATIONERY SET,1,12/8/2010 12:36,2.95,16016,United Kingdom
537773,85014A,BLACK/BLUE POLKADOT UMBRELLA,1,12/8/2010 12:36,5.95,16016,United Kingdom
537773,48187,DOORMAT NEW ENGLAND,1,12/8/2010 12:36,7.95,16016,United Kingdom
537773,22570,FELTCRAFT CUSHION RABBIT,1,12/8/2010 12:36,3.75,16016,United Kingdom
537773,22569,FELTCRAFT CUSHION BUTTERFLY,2,12/8/2010 12:36,3.75,16016,United Kingdom
537773,22111,SCOTTIE DOG HOT WATER BOTTLE,1,12/8/2010 12:36,4.95,16016,United Kingdom
537773,21479,WHITE SKULL HOT WATER BOTTLE ,1,12/8/2010 12:36,3.75,16016,United Kingdom
537773,21485,RETROSPOT HEART HOT WATER BOTTLE,1,12/8/2010 12:36,4.95,16016,United Kingdom
537773,22113,GREY HEART HOT WATER BOTTLE,1,12/8/2010 12:36,3.75,16016,United Kingdom
537773,22082,RIBBON REEL STRIPES DESIGN ,5,12/8/2010 12:36,1.65,16016,United Kingdom
537773,22144,CHRISTMAS CRAFT LITTLE FRIENDS,2,12/8/2010 12:36,2.1,16016,United Kingdom
537773,22142,CHRISTMAS CRAFT WHITE FAIRY ,2,12/8/2010 12:36,1.45,16016,United Kingdom
537773,21891,TRADITIONAL WOODEN SKIPPING ROPE,2,12/8/2010 12:36,1.25,16016,United Kingdom
537773,20725,LUNCH BAG RED RETROSPOT,2,12/8/2010 12:36,1.65,16016,United Kingdom
537773,20726,LUNCH BAG WOODLAND,1,12/8/2010 12:36,1.65,16016,United Kingdom
537773,20727,LUNCH BAG  BLACK SKULL.,1,12/8/2010 12:36,1.65,16016,United Kingdom
537773,20978,36 PENCILS TUBE SKULLS,1,12/8/2010 12:36,1.25,16016,United Kingdom
537773,22554,PLASTERS IN TIN WOODLAND ANIMALS,2,12/8/2010 12:36,1.65,16016,United Kingdom
537773,22553,PLASTERS IN TIN SKULLS,1,12/8/2010 12:36,1.65,16016,United Kingdom
537773,22961,JAM MAKING SET PRINTED,6,12/8/2010 12:36,1.45,16016,United Kingdom
537773,22149,FELTCRAFT 6 FLOWER FRIENDS,3,12/8/2010 12:36,2.1,16016,United Kingdom
537773,22147,FELTCRAFT BUTTERFLY HEARTS,1,12/8/2010 12:36,1.45,16016,United Kingdom
537773,22926,IVORY GIANT GARDEN THERMOMETER,2,12/8/2010 12:36,5.95,16016,United Kingdom
537773,22327,ROUND SNACK BOXES SET OF 4 SKULLS,1,12/8/2010 12:36,2.95,16016,United Kingdom
537773,22326,ROUND SNACK BOXES SET OF4 WOODLAND ,2,12/8/2010 12:36,2.95,16016,United Kingdom
537773,21967,PACK OF 12 SKULL TISSUES,1,12/8/2010 12:36,0.29,16016,United Kingdom
537773,21984,PACK OF 12 PINK PAISLEY TISSUES ,1,12/8/2010 12:36,0.29,16016,United Kingdom
537773,21981,PACK OF 12 WOODLAND TISSUES ,3,12/8/2010 12:36,0.29,16016,United Kingdom
537773,22960,JAM MAKING SET WITH JARS,6,12/8/2010 12:36,4.25,16016,United Kingdom
537773,22469,HEART OF WICKER SMALL,2,12/8/2010 12:36,1.65,16016,United Kingdom
537773,22556,PLASTERS IN TIN CIRCUS PARADE ,1,12/8/2010 12:36,1.65,16016,United Kingdom
537773,71477,COLOUR GLASS. STAR T-LIGHT HOLDER,5,12/8/2010 12:36,3.25,16016,United Kingdom
537773,21730,GLASS STAR FROSTED T-LIGHT HOLDER,1,12/8/2010 12:36,4.95,16016,United Kingdom
537773,85123A,WHITE HANGING HEART T-LIGHT HOLDER,1,12/8/2010 12:36,2.95,16016,United Kingdom
537773,22457,NATURAL SLATE HEART CHALKBOARD ,6,12/8/2010 12:36,2.95,16016,United Kingdom
537773,22082,RIBBON REEL STRIPES DESIGN ,5,12/8/2010 12:36,1.65,16016,United Kingdom
537773,21916,SET 12 RETRO WHITE CHALK STICKS,6,12/8/2010 12:36,0.42,16016,United Kingdom
537773,22627,MINT KITCHEN SCALES,1,12/8/2010 12:36,8.5,16016,United Kingdom
537773,22627,MINT KITCHEN SCALES,1,12/8/2010 12:36,8.5,16016,United Kingdom
537773,22624,IVORY KITCHEN SCALES,1,12/8/2010 12:36,8.5,16016,United Kingdom
537773,22411,JUMBO SHOPPER VINTAGE RED PAISLEY,3,12/8/2010 12:36,1.95,16016,United Kingdom
537773,21929,JUMBO BAG PINK VINTAGE PAISLEY,3,12/8/2010 12:36,1.95,16016,United Kingdom
537774,85199L,LARGE HANGING IVORY & RED WOOD BIRD,36,12/8/2010 12:40,0.65,14060,United Kingdom
537774,84347,ROTATING SILVER ANGELS T-LIGHT HLDR,48,12/8/2010 12:40,2.55,14060,United Kingdom
537774,84945,MULTI COLOUR SILVER T-LIGHT HOLDER,72,12/8/2010 12:40,0.85,14060,United Kingdom
537774,22144,CHRISTMAS CRAFT LITTLE FRIENDS,40,12/8/2010 12:40,1.85,14060,United Kingdom
537775,22846,BREAD BIN DINER STYLE RED ,4,12/8/2010 12:41,14.95,17722,United Kingdom
537775,22848,BREAD BIN DINER STYLE PINK,4,12/8/2010 12:41,14.95,17722,United Kingdom
537775,22847,BREAD BIN DINER STYLE IVORY,4,12/8/2010 12:41,14.95,17722,United Kingdom
537775,22849,BREAD BIN DINER STYLE MINT,1,12/8/2010 12:41,16.95,17722,United Kingdom
537775,21523,DOORMAT FANCY FONT HOME SWEET HOME,2,12/8/2010 12:41,7.95,17722,United Kingdom
537775,20685,DOORMAT RED RETROSPOT,2,12/8/2010 12:41,7.95,17722,United Kingdom
537775,72351A,SET/6 TURQUOISE BUTTERFLY T-LIGHTS,12,12/8/2010 12:41,2.1,17722,United Kingdom
